timestamp,status,scenario,commit,change_ref,total_nodes,avg_nodes_per_turn,deepest_completed_depth,notes
2026-03-09T05:19:07-07:00,discarded,profile,working-tree,wordbase-future-diversity-best-support-forward-reach-gate,340050,68010,3,"Weighted each distinct future word by the best supporting claimed cell's cached forward reach, giving full credit when a continuation survived through a deep lane like PERILLED and half credit when it only hung on through a shallow EEL-style pocket. The repeated-search profile regressed sharply from the 367930 baseline to 340050 total_nodes at the same depth 3, so I reverted without running profile-suite."
2026-03-09T05:22:51-07:00,discarded,profile,working-tree,wordbase-future-diversity-sturdy-support-cells,367930,73586,3,"Kept the raw distinct future-word count and added a much smaller tie-breaker for continuations preserved through at least two claimed cells, so PERILLED-style interior lanes could edge out words hanging on through a single EEL-style anchor. The repeated-search profile reproduced exactly at the 367930 baseline with depth 3 unchanged, so I reverted without running profile-suite."
2026-03-09T05:25:24-07:00,discarded,profile,working-tree,wordbase-future-diversity-best-support-forward-reach-side-agnostic,19735,3947,2,"Retried the assigned best-support forward-reach gate using a side-agnostic max of each preserving cell's cached forward reach, so continuations held through deep GLAMORIZE or PERILLED cells would get full credit while ones surviving only through shallow EEL pockets got half credit. It failed the primary repeated-search gate immediately: all five measured turns collapsed to INTERROBANG at depth 2 and total_nodes fell to 19735, so I reverted without running profile-suite."
2026-03-09T05:27:57-07:00,discarded,profile,working-tree,wordbase-future-diversity-best-support-forward-reach-additive-average,17735,3547,2,"Kept the raw distinct future-word count and added only a tiny side-agnostic average forward-reach tie-breaker for each future word's best supporting claimed cell, so continuations anchored through PERILLED-style interior squares could edge out ones surviving only through shallow EEL-style pockets. Even that small additive bonus immediately overfit toward INTERROBANG on all five measured turns, dropped to depth 2, and fell to 17735 total_nodes, so I reverted without running profile-suite."
2026-03-09T05:30:22-07:00,discarded,profile,working-tree,wordbase-future-diversity-best-support-forward-reach-path-average-gate,227456,45491,3,"Retried the assigned best-support-cell gate in a more conservative form by keeping each distinct future word once, tracking the strongest preserving cell by side-agnostic average forward reach, and only dropping to half credit when that best anchor was still shallower than the move's own typical lane. It still overfit immediately toward INTERROBANG, two of five measured turns fell to depth 2, and the repeated-search profile dropped to 227456 total_nodes, so I reverted without running profile-suite."
2026-03-09T05:33:09-07:00,discarded,profile,working-tree,wordbase-future-diversity-capped-support-count,367930,73586,3,"Kept the raw distinct future-word count and added only a capped path-wide support-count bonus, so future attacks preserved through several claimed cells along a PERILLED-style lane could edge out ones surviving through a single EEL-style pocket. The repeated-search profile reproduced exactly at the 367930 baseline with depth 3 unchanged, so I reverted without running profile-suite."
2026-03-09T05:37:17-07:00,discarded,profile,working-tree,wordbase-future-diversity-best-support-bidirectional-interior-quarter-credit,21000,4200,2,"Kept the raw distinct future-word count and added only a quarter-credit tie-breaker for continuations whose best preserving cell stayed interior for both sides, so future attacks held through the middle of PERILLED or GLAMORIZE could edge out ones surviving only through a shallow EEL-style pocket. It still failed the primary repeated-search gate immediately: all five measured turns collapsed to INTERROBANG, deepest_completed_depth fell to 2, and total_nodes dropped to 21000, so I reverted without running profile-suite."
2026-03-09T05:39:16-07:00,discarded,profile,working-tree,wordbase-future-diversity-best-support-forward-reach-relative-quarter-gate,17620,3524,2,"Tracked each distinct future word by the strongest side-agnostic forward-reach cell in the move, but only shaved shallow anchors to three-quarter credit when they fell below the move's own average lane support, so PERILLED-style lanes would still beat EEL-style pockets without replacing the broad count. Even that light relative gate overfit immediately: all five measured turns collapsed to INTERROBANG, deepest_completed_depth fell to 2, and total_nodes dropped to 17620, so I reverted without running profile-suite."
2026-03-09T05:41:14-07:00,discarded,profile,working-tree,wordbase-future-diversity-best-support-forward-reach-strong-anchor-tiebreak,19535,3907,2,"Kept the raw distinct future-word count and added only a tiny extra count for distinct future words whose best preserving cell had clearly interior side-agnostic forward reach, so continuations anchored through the middle of PERILLED would edge out ones surviving only through a shallow EEL pocket. Even this narrow tie-breaker still overfit immediately: all five measured turns collapsed to INTERROBANG, deepest_completed_depth fell to 2, and total_nodes dropped to 19535, so I reverted without running profile-suite."
2026-03-09T05:43:14-07:00,discarded,profile,working-tree,wordbase-long-future-diversity-support-reach-quarter-gate,367930,73586,3,"Changed only longFutureMoveDiversityBonus to dedupe long follow-ups as before but shave each one to three-quarter credit unless its preserving claimed cell already had clearly interior combined forward reach, so GLAMORIZE or PERILLED-style long lanes could stay at full credit while shallow edge cleanups lost a little weight. The repeated-search profile reproduced exactly at the 367930 baseline with depth 3 unchanged and identical INTERROBANG ordering on all five measured turns, so I reverted without running profile-suite."
2026-03-09T05:45:09-07:00,discarded,profile,working-tree,wordbase-long-future-diversity-side-agnostic-forward-reach-half-to-full,367930,73586,3,"Changed only longFutureMoveDiversityBonus to keep deduped long follow-ups path-local but scale each one from half to full credit using the best preserving square's side-agnostic forward reach, so interior long lanes like GLAMORIZE or PERILLED could outrank long words surviving only through shallow edge cleanup pockets. The repeated-search profile reproduced exactly at the 367930 baseline with depth 3 unchanged and identical INTERROBANG ordering on all five measured turns, so I reverted without running profile-suite."
2026-03-09T05:47:58-07:00,discarded,profile,working-tree,wordbase-long-future-diversity-best-support-forward-reach-three-band,367930,73586,3,"Changed only longFutureMoveDiversityBonus to dedupe long follow-ups as before, track each long word by the strongest preserving squares side-agnostic forward reach, and band that support from half to full credit so GLAMORIZE or PERILLED-style interior lanes could outrank long words surviving only through shallow side cleanup pockets. The repeated-search profile reproduced exactly at the 367930 baseline with depth 3 unchanged and identical INTERROBANG ordering on all five measured turns, so I reverted without running profile-suite."
2026-03-09T05:50:57-07:00,discarded,profile,working-tree,wordbase-letter-rarity-best-cell-forward-reach-gated,367770,73554,3,"Added a cached board-letter histogram and changed the rare-letter tie-break to keep only the single strongest claimed cell after gating it by the same per-side square forward reach used elsewhere, so the README board's interior GLAMORIZE 'z' could still matter without letting several merely uncommon letters add up along a longer path. The repeated-search profile regressed below the retained baseline and the assigned 370025 floor: total_nodes fell to 367770, avg_nodes_per_turn to 73554, depth stayed 3, and all five measured turns still ordered INTERROBANG first, so I reverted without running profile-suite."
2026-03-09T05:54:59-07:00,discarded,profile,working-tree,wordbase-letter-rarity-top-two-forward-reach-gated,367830,73566,3,"Added a cached board-letter histogram and a clipped rare-letter tie-break that kept only the two strongest forward-reach-gated claimed cells, with the second one at half weight so a README-style interior GLAMORIZE 'z' could still matter without letting several merely uncommon letters along a shallow lane add up. The repeated-search profile still regressed below both the retained branch baseline and the 370025 floor: total_nodes fell to 367830, avg_nodes_per_turn to 73566, depth stayed 3, and all five measured turns still ordered INTERROBANG first, so I reverted without running profile-suite."
