timestamp,status,scenario,commit,change_ref,total_nodes,avg_nodes_per_turn,deepest_completed_depth,notes
2026-03-08T20:14:09-07:00,baseline,profile,bf81c22,steady-state-profiling-benchmark,246590,49318,3,"5 repeated searches after 2 warmup turns; benchmark from scripts/run-benchmarks.sh profile"
2026-03-08T20:14:09-07:00,kept,profile,e15793c,tt-verification-key,246590,49318,3,"Added independent TT verification key and collision regression test; no measured node change on profile baseline"
2026-03-08T20:14:09-07:00,discarded,profile,working-tree,pvs-null-window,190870,38174,3,"Principal variation search reduced repeated-search throughput versus baseline; reverted"
2026-03-08T20:14:09-07:00,discarded,profile,working-tree,tt-hash-move-ordering,174115,34823,3,"TT move-to-front ordering reduced repeated-search throughput versus baseline; reverted"
2026-03-08T20:14:09-07:00,discarded,profile,working-tree,fixed-size-tt-table,246590,49318,3,"Direct-index TT table with simple overwrite policy did not improve repeated-search node count; reverted"
2026-03-08T20:14:09-07:00,discarded,profile,working-tree,root-pv-ordering,208000,41600,3,"Iterative-deepening root preferred move ordering reduced repeated-search throughput versus baseline; reverted"
2026-03-08T20:14:09-07:00,discarded,profile,working-tree,cached-goodness-evaluation,246590,49318,3,"Incremental leaf evaluation preserved behavior but did not improve repeated-search node count; reverted"
2026-03-08T20:14:09-07:00,discarded,profile,working-tree,killer-moves,174125,34825,3,"Generic killer-move ordering reduced repeated-search throughput versus baseline; reverted"
2026-03-08T20:14:09-07:00,kept,profile,75be3ca,wordbase-path-heuristic-v1,275945,55189,3,"Added static move-ordering bonuses for word length, edge progress, and bomb contact; repeated-search baseline improved and reproduced"
2026-03-08T20:14:09-07:00,discarded,profile,working-tree,wordbase-path-heuristic-v2-edge-bonus,258010,51602,3,"Extra near-edge bonus reduced repeated-search throughput versus v1; reverted"
2026-03-08T20:14:09-07:00,discarded,profile,working-tree,wordbase-path-heuristic-v3-no-bomb-bonus,238095,47619,3,"Removing bomb and megabomb bonuses reduced repeated-search throughput versus v1; reverted"
2026-03-08T20:14:09-07:00,discarded,profile,working-tree,wordbase-path-heuristic-v4-endpoint-bonus,252465,50493,3,"Endpoint-row bonus reduced repeated-search throughput versus v1; reverted"
2026-03-08T20:14:09-07:00,discarded,profile,working-tree,wordbase-path-heuristic-v5-length24,237915,47583,3,"Increasing the length bonus above v1 reduced repeated-search throughput; reverted"
2026-03-08T20:14:09-07:00,discarded,profile,working-tree,wordbase-path-heuristic-v6-progress40,252795,50559,3,"Increasing the progress bonus above v1 reduced repeated-search throughput; reverted"
2026-03-08T20:14:09-07:00,discarded,profile,working-tree,wordbase-path-heuristic-v7-progress24,275140,55028,3,"Lowering the progress bonus was close to v1 but still slightly worse; reverted"
2026-03-08T20:14:09-07:00,discarded,profile,working-tree,wordbase-path-heuristic-v8-bomb64,264610,52922,3,"Lowering bomb and megabomb bonuses reduced repeated-search throughput versus v1; reverted"
2026-03-08T20:14:09-07:00,discarded,profile,working-tree,wordbase-path-heuristic-v9-span24,238185,47637,3,"Forward-span bonus reduced repeated-search throughput versus v1; reverted"
2026-03-08T20:14:09-07:00,discarded,profile,working-tree,recordOne-already-owned-early-return,275945,55189,3,"Skipping already-owned cells in recordOne preserved behavior but did not improve the repeated-search baseline"
2026-03-08T20:14:09-07:00,discarded,profile,working-tree,recordOne-iterative-propagation,275945,55189,3,"Iterative bomb propagation in recordOne preserved behavior but did not improve the repeated-search baseline; reverted"
2026-03-08T20:14:09-07:00,discarded,profile,working-tree,dynamic-front-window-ordering,187145,37429,3,"State-aware front-window reranking by claimable and enemy path cells reduced repeated-search throughput badly versus v1; reverted"
2026-03-08T20:14:09-07:00,discarded,profile,working-tree,wordbase-square-mobility-divisor8,261675,52335,3,"Adding a weak future-mobility bonus from per-square legal-word counts underperformed the stronger variants"
2026-03-08T20:14:09-07:00,discarded,profile,working-tree,wordbase-square-mobility-divisor4,277530,55506,3,"A moderate future-mobility bonus improved profile slightly but was dominated by stronger scaling"
2026-03-08T20:14:09-07:00,discarded,profile,working-tree,wordbase-square-mobility-divisor2,278125,55625,3,"A stronger future-mobility bonus improved profile but still underperformed divisor1"
2026-03-08T20:14:09-07:00,kept,profile,working-tree,wordbase-square-mobility-divisor1,339260,67852,3,"Added a per-square future-mobility bonus from legal-word counts across the claimed path; profile rose from 275945 to 339260 and short rose from 81916 to 84370"
2026-03-08T20:14:09-07:00,discarded,profile,working-tree,depth-based-move-cap-120-60,122100,24420,3,"Shrinking the move cap aggressively by ply cut away too much search and reduced both short and repeated-search benchmarks"
2026-03-08T20:14:09-07:00,discarded,profile,working-tree,wordbase-forward-mobility-bonus-32,337075,67415,3,"Extra forward-weighted mobility on top of raw mobility improved short slightly but lost on repeated search"
2026-03-08T20:14:09-07:00,discarded,profile,working-tree,wordbase-future-diversity-divisor8,339725,67945,3,"A weak future-move diversity bonus was worse than the stronger diversity variants"
2026-03-08T20:14:09-07:00,discarded,profile,working-tree,wordbase-future-diversity-divisor4,345410,69082,3,"A moderate future-move diversity bonus improved on raw mobility but was beaten by divisor2"
2026-03-08T20:14:09-07:00,discarded,profile,working-tree,wordbase-future-diversity-divisor1,22785,4557,2,"Overweighting future-move diversity collapsed the search and dropped completed depth"
2026-03-08T20:14:09-07:00,kept,profile,working-tree,wordbase-future-diversity-divisor2,354475,70895,3,"Added a future-move diversity bonus based on unique legal starts unlocked by the claimed path; profile rose from 339260 to 354475 and short rose to 87822"
2026-03-08T20:14:09-07:00,discarded,profile,working-tree,tt-hash-move-ordering-retest,182050,36410,3,"TT hash-move ordering still reduced throughput badly even after the stronger Wordbase ordering baseline; reverted"
2026-03-08T20:14:09-07:00,discarded,profile,working-tree,wordbase-deep-diversity-frontier,221088,44217,3,"Biasing diversity toward the deepest claimed cells looked promising in one run but was not repeatable and was reverted"
2026-03-08T20:14:09-07:00,discarded,profile,working-tree,wordbase-peak-anchor-quality,81955,16391,2,"Using the best future word from claimed anchors overfit flashy lines and collapsed repeated-search depth"
2026-03-08T20:14:09-07:00,discarded,profile,working-tree,wordbase-long-word-count,17775,3555,2,"Counting long future words per square was another unstable anchor-quality signal and was reverted"
2026-03-08T20:14:09-07:00,kept,profile,working-tree,wordbase-long-future-diversity,364230,72846,3,"Added a long-word diversity bonus so paths preserving many distinct long threats are ordered earlier; profile rose from 354475 to 364230"
2026-03-08T21:21:32-07:00,kept,profile,0ca2b91,find-first-renumbered-goodness,364230,72846,3,Use_find_first_no_behavior_change
2026-03-08T21:22:25-07:00,discarded,profile,working-tree,wordbase-bend-penalty-k8,363915,72783,3,"Added a small bend penalty to prefer straighter lanes; repeated-search nodes regressed slightly vs baseline 364230 so reverting"
2026-03-08T21:23:04-07:00,discarded,profile,working-tree,endpoint-anchor-bonus-divisor6,364230,72846,3,No measurable change versus baseline; reverted to divisor8
2026-03-08T21:23:16-07:00,kept,profile,working-tree,wordbase-letter-rarity-target6-divisor2,364270,72854,3,"Added a rare-letter tie-breaker favoring paths that claim scarce letters (e.g., the lone 'z' along GLAMORIZE). On the profile scenario total_nodes rose from 364230 to 364270 and deepest_completed_depth stayed 3; effect is tiny but repeatable."
2026-03-08T21:23:30-07:00,discarded,profile,working-tree,wordbase-neighborhood-halo-divisor48,18005,3601,2,"Added a very weak 8-neighbor halo bonus; repeated-search depth collapsed from 3 to 2, so reverting"
2026-03-08T21:26:45-07:00,discarded,profile,working-tree,wordbase-neighborhood-max-halo-k96,364230,72846,3,Added a max-halo neighborhood tie-breaker (3x3 local mobility, single best cell per path) with a stiff divisor; profile repeated-search nodes unchanged vs baseline so reverting
2026-03-08T21:27:14-07:00,discarded,profile,working-tree,wordbase-letter-rarity-target6-divisor2,364230,72846,3,"After implementing the rare-letter tie-breaker, repeated-search totals matched baseline (no throughput or depth change). Keeping tree clean and reverting."
2026-03-08T21:31:51.827024-07:00,discarded,profile,working-tree,wordbase-row-band-diversity-weight8,364230,72846,3,"Added a row-band diversity bonus that rewards paths spanning many distinct rows (e.g., GLAMORIZE diagonal vs GLASS horizontal). Repeated-search totals unchanged vs baseline; reverting."
2026-03-08T21:34:17-07:00,discarded,profile,working-tree,wordbase-column-band-diversity-weight8,364230,72846,3,"Added a small column-band diversity bonus so diagonals like GLAMORIZE beat one-file paths like EEL when other signals tie. Repeated-search totals reproduced exactly at baseline, so reverting."
2026-03-08T21:35:19-07:00,discarded,profile,working-tree,wordbase-frontier-square-word-count-divisor6,364230,72846,3,"Added a frontier mobility bonus from unique neighboring squares around the claimed path (e.g., GLAMORIZE leaves side shoulders; EEL mostly stacks starts on one file). At divisor 6 the repeated-search profile stayed exactly at baseline, so trying a stronger scaling."
2026-03-08T21:35:51-07:00,discarded,profile,working-tree,wordbase-frontier-square-word-count-divisor2,345895,69179,3,"Strengthening the frontier neighboring-word-count bonus reordered search in the wrong direction: repeated-search profile fell from 364230 to 345895 while depth stayed 3. Reverting that scaling and trying a less correlated frontier signal."
2026-03-08T21:36:25-07:00,discarded,profile,working-tree,wordbase-frontier-square-count-weight12,340310,68062,3,"Switched to a geometry-only frontier count that rewards paths exposing many neighboring squares. It was even noisier: repeated-search profile fell to 340310 with no extra depth, so reverting to the known-good baseline."
2026-03-08T21:39:08-07:00,discarded,profile,working-tree,wordbase-future-word-text-diversity-divisor4,364230,72846,3,"Counted distinct future word texts so a lane leaving {stare, stern, stone} would outrank one mostly preserving repeated GLAMORIZE placements. At divisor 4 the repeated-search profile matched the 364230 baseline exactly, so reverting."
2026-03-08T21:39:08-07:00,discarded,profile,working-tree,wordbase-future-word-text-diversity-divisor2,364230,72846,3,"Strengthening the distinct future word-text bonus still produced the exact 364230 repeated-search profile total with depth 3. The text-level signal was too correlated with the existing mobility/diversity stack, so reverting."
2026-03-08T21:41:42-07:00,discarded,profile,working-tree,wordbase-future-progress-row-coverage-weight8,17760,3552,2,"Rewarded paths whose future follow-ups land on several forward rows instead of one band. That reordered the profile position badly enough to stall at depth 2 on every repeated search, so reverting."
2026-03-08T21:42:52-07:00,discarded,profile,working-tree,wordbase-future-start-square-coverage-weight6,18005,3601,2,"Rewarded paths that preserved many distinct future start squares. That favored noisy multi-anchor clutter over the baseline ordering and every repeated search stalled at depth 2, so reverting."
2026-03-08T21:43:36-07:00,discarded,profile,working-tree,wordbase-long-future-start-square-coverage-weight8,18005,3601,2,"Restricted the start-square coverage bonus to long follow-ups only, hoping to favor separate long-threat anchors. It still shoved the profile search into the same bad depth-2 ordering, so reverting."
2026-03-08T21:47:48-07:00,discarded,profile,working-tree,wordbase-long-square-word-count-divisor4,17775,3555,2,"Summed per-square counts of long words along the claimed path so the middle of a GLAMORIZE lane would outrank side squares that mostly feed GLASS. The signal was far too strong: repeated-search depth fell from 3 to 2, so reverting."
2026-03-08T21:47:48-07:00,kept,profile,working-tree,wordbase-square-forward-reach-divisor4,364570,72914,3,"Added a small per-square forward-reach bonus based on the average depth of words through each claimed cell, so lanes used by deeper attacks like PERILLED break ties over squares whose words stall locally. The repeated-search profile improved reproducibly from 364230 to 364570 in two runs, and short held at 87981."
2026-03-08T22:04:00-08:00,discarded,profile,working-tree,wordbase-square-unique-word-text-count-divisor4,19405,3881,2,"Added a per-square distinct-word-text bonus so squares shared by different words like STARE/STERN/STONE would outrank squares inflated by many placements of one stem family. The signal was far too disruptive: repeated-search profile collapsed from 364570 to 19405 total nodes and depth 2, so reverting."
2026-03-08T22:27:41-07:00,discarded,profile,working-tree,wordbase-gated-letter-rarity-by-forward-reach,295163,59032.6,3,"Scaled rare-letter credit by above-average square forward reach so deep-lane letters like the GLAMORIZE z would matter more than shallow side branches. The repeated-search profile was not stable: one run fell to depth 2 with only 3507 nodes, dropping total_nodes well below the 364570 baseline, so reverting."
2026-03-08T22:34:33-07:00,discarded,profile,working-tree,wordbase-strong-forward-reach-cell-count,364570,72914,3,"Counted claimed cells whose forward-reach score was at least one point above the board-average table value, so lanes with several strong cells like PERILLED could separate from mixed paths with one standout GLAMORIZE square. The repeated-search profile stayed exactly flat at the 364570 baseline across all five runs, so the signal was too correlated with the existing forward-reach sum and I reverted."
2026-03-08T22:31:00-07:00,discarded,profile,working-tree,wordbase-forward-reach-excess-over-average-divisor8,156349,31269.8,3,"Added a tiny companion bonus that summed only the positive forward-reach excess above the board-wide table average, hoping uniformly deep lanes like PERILLED would edge out paths with one standout GLAMORIZE square plus shallow filler. The repeated-search profile was unstable and much worse: two of five runs fell to depth 2 on INTERROBANG and total_nodes dropped far below the 364570 baseline, so I reverted without running profile-suite."
2026-03-08T22:33:15-07:00,discarded,profile,working-tree,wordbase-forward-reach-average-consistency-divisor8,360520,72104,3,"Added a tiny companion bonus for average forward reach per claimed cell, hoping uniformly deep lanes like PERILLED would beat paths padded by one standout GLAMORIZE square plus shallow filler. The repeated-search profile was stable but worse than the 364570 baseline at 360520 total_nodes, so I reverted without running profile-suite."
2026-03-08T22:34:51-07:00,discarded,profile,working-tree,wordbase-strong-forward-reach-cell-gate-average,360280,72056,3,"Added a tiny gate that only rewarded paths with at least three above-average forward-reach cells, so uniformly deep lanes like PERILLED could beat a mixed GLAMORIZE path with one standout anchor and shallow filler. The repeated-search profile was stable but worse than the 364570 baseline at 360280 total_nodes, so I reverted without running profile-suite."
2026-03-08T22:37:18-07:00,discarded,profile,working-tree,wordbase-strong-forward-reach-count-average,360285,72057,3,"Counted claimed cells whose forward-reach score was at or above the board-average table value, so lanes with several solid cells like PERILLED could beat mixed GLAMORIZE paths that lean on one peak anchor. The repeated-search profile was perfectly stable but worse than the 364570 baseline at 360285 total_nodes, so I reverted without running profile-suite."
2026-03-08T22:39:05-07:00,discarded,profile,working-tree,wordbase-strong-forward-reach-adjacent-pairs-average,360120,72024,3,"Added a tiny bonus for consecutive claimed cells whose forward-reach score stayed at or above the board-average table value, so sustained lanes like PERILLED could separate from paths with one standout GLAMORIZE anchor plus shallow cleanup cells. The repeated-search profile was perfectly stable but worse than the 364570 baseline at 360120 total_nodes, so I reverted without running profile-suite."
2026-03-08T22:41:16-07:00,discarded,profile,working-tree,wordbase-strong-forward-reach-count-median,360370,72074,3,"Counted claimed cells whose forward-reach score was at or above the board-local median, so lanes with several solid cells like PERILLED could separate from mixed GLAMORIZE paths that rely on one standout square. The repeated-search profile was perfectly stable but worse than the 364570 baseline at 360370 total_nodes, so I reverted without running profile-suite."
2026-03-08T22:43:52-07:00,kept,profile-suite,working-tree,wordbase-square-word-count-forward-reach-gate-half-to-full,367930,73586,3,"Scaled each cell's raw word-count bonus from half credit up to full credit using that side's cached square forward reach, so deep dense lanes like GLAMORIZE and PERILLED keep their tie-breaker while shallow cleanup pockets like EEL are damped. The repeated-search profile improved reproducibly from 364570 to 367930 total_nodes at depth 3, and profile-suite also improved on every board: readme-main 364570->367930, driver-sample-a 298205->308045, driver-sample-b 2010->381725 with depth 4 preserved."
2026-03-08T22:48:13-07:00,discarded,profile,working-tree,wordbase-goalward-lane-branching-next-cell,368000,73600,3,"Counted each square's distinct next-step neighbors that stayed goalward or flat in later word positions, so PERILLED-style interiors could beat EEL pockets that mostly branch sideways. The repeated-search profile reproduced exactly at 368000 total_nodes in two runs with depth 3 intact, but the gain over the 367930 baseline was only +70 nodes, so I reverted without running profile-suite."
2026-03-08T22:50:36-07:00,discarded,profile,working-tree,wordbase-goalward-lane-branching-prev-or-next,297749,59549.8,3,"Counted each square's distinct previous-or-next neighbors from legal words only when that adjacent cell stayed goalward or flat, so PERILLED-style interiors could accumulate broad non-retreating branch credit while EEL-style side pockets lost backward clutter. The repeated-search profile was unstable and much worse than the 367930 baseline: one of five runs dropped to depth 2 with only 3349 nodes, so I reverted without running profile-suite."
2026-03-08T22:53:04-07:00,discarded,profile,working-tree,wordbase-goalward-lane-branching-next-cell-forward-reach-gated,363820,72764,3,"Counted each square's distinct next-step neighbors that stayed goalward or flat, then gated that branching credit by the same cached forward-reach score so deep lanes like PERILLED would keep more of it than shallow sideways pockets like EEL. The repeated-search profile reproduced exactly at 363820 total_nodes with depth 3 intact, but that was a clear regression from the 367930 baseline, so I reverted without running profile-suite."
2026-03-08T22:55:39-07:00,discarded,profile,working-tree,wordbase-goalward-lane-branching-next-cell-strict-forward,367965,73593,3,"Counted each square's distinct later word cells only when the next step moved strictly toward goal, so PERILLED-style forks kept credit while same-row cleanup pockets like EEL lost it. The repeated-search profile reproduced exactly at 367965 total_nodes with depth 3 intact, but the gain over the 367930 baseline was only +35 nodes, so I reverted without running profile-suite."
2026-03-08T22:59:53-07:00,discarded,profile,working-tree,wordbase-policy-table-top48-rerank-v1,46105,9221,2,"Added an optional table-driven policy overlay that reranked the top 48 already-good moves using broad static features like per-cell forward reach, future diversity, and bomb touches. The repeated-search profile immediately overfit the README board in the wrong direction: all five measured turns fell to depth 2 on INTERROBANG with only 46105 total_nodes, so I reverted without running profile-suite."
2026-03-08T23:02:09-07:00,discarded,profile,working-tree,wordbase-future-word-family-diversity-bonuses,18135,3627,2,"Added small extra bonuses for distinct future word families after collapsing duplicate path copies of the same text, so paths preserving several different attacks like STARE plus STONE could beat lanes that mostly preserved duplicate GLAMORIZE copies. The repeated-search profile immediately overfit in the wrong direction: after the same warmup it chose INTERROBANG on all five measured turns, fell to depth 2, and dropped to 18135 total_nodes, so I reverted without running profile-suite."
2026-03-08T23:06:08-07:00,discarded,profile,working-tree,wordbase-policy-table-near-ties-disk-cache,17215,3443,2,"Prototyped an optional disk-backed policy overlay that attached per-move float scores from broad static features and only stable-reranked the top near-tie prefix, hoping PERILLED-style lanes would break ties without disturbing the baseline ordering. Even with the narrow prefix/slack guard it immediately overfit toward INTERROBANG on all five measured turns, dropped to depth 2, and fell to 17215 total_nodes, so I reverted without running profile-suite."
