timestamp,status,scenario,commit,change_ref,total_nodes,avg_nodes_per_turn,deepest_completed_depth,notes
2026-03-08T23:03:49-07:00,discarded,profile,working-tree,wordbase-square-long-word-count-divisor8,365485,73097,3,"Added a small per-square long-word count bonus so GLAMORIZE/PERILLED-style lanes could beat EEL-style cleanup pockets even when both touched similar raw word counts. The repeated-search profile improved reproducibly from 365465 to 365485 at depth 3, but the gain was only +20 total nodes across two runs, so reverting as too marginal to keep without a suite run."
2026-03-08T23:06:24-07:00,discarded,profile,working-tree,wordbase-square-long-word-text-count-divisor8,360390,72078,3,"Added a small per-square bonus for distinct long word texts, so lanes supporting several different long attacks like GLAMORIZE/GLAMORIZED/GLAMORIZER could beat cleanup pockets with many overlapping long paths. The repeated-search profile stayed at depth 3 but regressed clearly from the 365465 baseline to 360390 total nodes, so reverting without a suite run."
2026-03-08T23:09:42-07:00,discarded,profile,working-tree,wordbase-square-goal-depth-coverage-divisor2,17770,3554,2,"Added a small per-square bonus for distinct goal depths reached by words through each claimed cell, aiming to reward PERILLED-style lanes that can finish on several rows over EEL-style pockets that mostly recycle one shallow finish row. The repeated-search profile collapsed immediately from the 365465 baseline to 17770 total nodes and every measured turn fell to depth 2, so reverting without a suite run."
2026-03-08T23:14:47-07:00,discarded,profile,working-tree,wordbase-policy-overlay-avg-lane-default-table,365525,73105,3,"Added an optional disk-loaded policy overlay that attached a per-move float score and gave a tiny averaged lane-quality bonus, aiming to let focused lanes like PERILLED outrank shallow cleanup words like EEL without swamping the base heuristic. The repeated-search profile improved reproducibly from the 365465 baseline to 365525 at depth 3, but the gain was only +60 total nodes across two runs, so reverting as too marginal to keep without a suite run."
2026-03-08T23:18:00-07:00,kept,profile-suite,working-tree,wordbase-square-remaining-goalward-reach-divisor4,365605,73121,3,"Added a small per-square bonus for average remaining goalward reach beyond each claimed cell, so middle launch squares with several rows of runway left like PERILLED could outrank already-advanced cleanup pockets like EEL that usually finish immediately. The repeated-search profile improved reproducibly from the 365465 baseline to 365605 at depth 3, and profile-suite also improved overall: readme-main 365465->365605, driver-sample-a 304875->304925, driver-sample-b held at 1960 while staying depth 4."
2026-03-08T23:21:46-07:00,discarded,profile,working-tree,wordbase-policy-overlay-broad-static-tiebreak,364935,72987,3,"Added an optional WORDBASE_POLICY_TABLE hook that loaded broad board-derived overlay weights from disk and used the resulting float as a secondary sort key only, aiming to break PERILLED-style lane ties over EEL-style cleanup pockets without changing evaluation. With forward-reach, remaining-runway, branching, and diversity weights enabled, the repeated-search profile regressed clearly from the 365605 baseline to 364935 total nodes at depth 3, so reverting without a suite run."
2026-03-08T23:21:46-07:00,discarded,profile,working-tree,wordbase-policy-overlay-remaining-branching-tiebreak,364935,72987,3,"Retried the optional disk-loaded policy overlay as an even narrower tie-break using only average remaining goalward reach and excess goalward branching, hoping to reproduce the earlier marginal overlay win while staying aligned with the strongest static lane signals. The repeated-search profile landed at the same regressed 364935 total nodes versus the 365605 baseline while staying at depth 3, so reverting without a suite run."
2026-03-08T23:24:19-07:00,discarded,profile,working-tree,wordbase-square-remaining-goalward-letters-divisor4,17775,3555,2,"Added a small per-square bonus for average remaining goalward letters after each claimed cell, aiming to favor PERILLED-style interior lanes with several letters of follow-through over EEL-style cleanup pockets that usually end immediately. The repeated-search profile collapsed immediately from the 365605 baseline to 17775 total nodes and every measured turn fell to depth 2, so reverting without a suite run."
2026-03-08T23:26:30-07:00,discarded,profile,working-tree,wordbase-square-next-step-remaining-goalward-reach-divisor4,364935,72987,3,"Added a small per-square bonus for the average remaining goalward reach of each immediate goalward continuation, aiming to favor PERILLED-style lanes whose next steps still have runway over EEL-style cleanup pockets whose next cells are nearly finished. The repeated-search profile regressed clearly from the 365605 baseline to 364935 total nodes at depth 3, so reverting without a suite run."
2026-03-08T23:28:52-07:00,discarded,profile,working-tree,wordbase-square-long-word-count-divisor4,17775,3555,2,"Added a small per-square bonus for how many long words cross each claimed cell, aiming to favor PERILLED-style launch lanes that sit inside several deep attacks over EEL-style cleanup pockets whose traffic is mostly short finishers. The repeated-search profile collapsed immediately from the 365605 baseline to 17775 total nodes and every measured turn fell to depth 2, so reverting without a suite run."
2026-03-08T23:35:45-07:00,discarded,profile,working-tree,wordbase-policy-overlay-linear-tied-only,365640,73128,3,"Added an optional disk-loaded linear policy overlay that assigned each move a float score from broad board-derived features and used it only to refine equal-goodness ordering, aiming to give PERILLED-style launch lanes a smoother tie-break over EEL-style cleanup pockets without changing evaluation. The repeated-search profile reproduced at 365640 total nodes and depth 3 in two runs versus the 365605 baseline, but the +35-node gain was too marginal to treat as a clear win, so reverting without a suite run."
2026-03-08T23:42:10-07:00,discarded,profile,working-tree,wordbase-policy-overlay-anchor-runway-tiebreak,364915,72983,3,"Added an optional disk-loaded policy table stub that attached a per-move float score from broad static lane signals and weighted the opening square's remaining runway and goalward fanout to break equal-goodness ties, aiming to let PERILLED-style launch anchors outrank EEL-style cleanup pockets without changing evaluation. With the default overlay enabled, the repeated-search profile regressed clearly from the 365605 baseline to 364915 total nodes at depth 3, so reverting without a suite run."
2026-03-08T23:43:54-07:00,discarded,profile,working-tree,wordbase-square-goalward-branching-runway-divisor8,17775,3555,2,"Added a composite per-square bonus that multiplied excess goalward branching by remaining goalward runway, aiming to reward PERILLED-style interior forks that can still branch for several rows over EEL-style cleanup forks near the finish. At divisor 8 the repeated-search profile collapsed immediately from the 365605 baseline to 17775 total nodes and every measured turn fell to depth 2, so reverting and retrying only with a much weaker scale."
2026-03-08T23:44:22-07:00,discarded,profile,working-tree,wordbase-square-goalward-branching-runway-divisor32,365605,73121,3,"Retried the same branch-times-runway signal as a much smaller tie-break so only interior PERILLED-style forks with real runway could separate from EEL-style cleanup forks. The repeated-search profile reproduced the 365605 baseline exactly at depth 3, so the feature was effectively flat and I reverted without a suite run."
2026-03-08T23:47:04-07:00,discarded,profile,working-tree,wordbase-killer-history-lmr-conservative,8345,1669,3,"Added TT-first killer/history move ordering plus conservative late-move reductions in `gtsa.hpp`, aiming to let repeated cutoffs promote the same broad launch lanes while only trimming late non-TT cleanup tries. The repeated-search profile regressed catastrophically from the 365605 baseline to 8345 total nodes at depth 3, so I reverted without a suite run."
2026-03-08T23:49:57-07:00,discarded,profile,working-tree,wordbase-killer-history-ordering-only,167580,33516,3,"Retried the search-tuning assignment with only TT-first killer/history move ordering and no reductions, so repeated beta-cut launch lanes could float above later cleanup tries while preserving the existing board-derived fallback order. After forcing a rebuild of `perf-test`, the repeated-search profile still regressed clearly from the 365605 baseline to 167580 total nodes at depth 3, so I reverted without a suite run."
2026-03-08T23:51:10-07:00,discarded,profile,working-tree,wordbase-tt-move-front-only,167580,33516,3,"Tried the narrowest follow-up in `gtsa.hpp`: if a transposition-table move was still legal, rotate only that move to the front and otherwise preserve the existing board-derived static order, aiming to replay proven INTERROBANG/PERILLED lanes before later cleanup tries without introducing global killer or history promotion. The repeated-search profile reproduced the same 167580 total nodes and 33516 average nodes-per-turn regression at depth 3, so TT-first ordering alone was also a clear loss and I reverted without a suite run."
2026-03-08T23:53:25-07:00,discarded,profile,working-tree,wordbase-square-word-count-saturation-threshold16-divisor4,293210,58642,3,"Changed only squareWordCountBonus in src/board.h to keep each cell linear through 16 words and then grow the excess at one quarter speed, aiming to keep GLAMORIZE-style rich spines ahead of dead cells while stopping overcrowded overlap pockets from outranking cleaner deep lanes like PERILLED. The repeated-search profile regressed clearly from the 365605 baseline to 293210 total nodes and 58642 average nodes-per-turn at depth 3, so I reverted without a suite run."
2026-03-08T23:54:29-07:00,discarded,profile,working-tree,wordbase-square-word-count-saturation-threshold16-half-excess,338240,67648,3,"Changed only squareWordCountBonus in src/board.h to keep each cell linear through 16 words and count any excess at half speed, aiming to preserve GLAMORIZE-style rich spines while stopping overlap-heavy hotspots from outranking cleaner PERILLED-style lanes on raw duplicate density alone. The repeated-search profile still regressed clearly from the 365605 baseline to 338240 total nodes and 67648 average nodes-per-turn at depth 3, so I reverted without a suite run."
2026-03-08T23:57:19-07:00,discarded,profile,working-tree,wordbase-square-goalward-span-divisor8,365765,73153,3,"Added a small per-square bonus for the average total row span of words through each claimed cell, aiming to let interior PERILLED-style squares inside long lanes beat crowded EEL-style cleanup pockets that mostly recycle nearby rows. The repeated-search profile improved reproducibly but only marginally from the 365605 baseline to 365765 total nodes and 73153 average nodes-per-turn at depth 3, so the gain was too small to treat as a clear win and I reverted without a suite run."
2026-03-08T23:57:41-07:00,discarded,profile,working-tree,wordbase-square-goalward-span-divisor4,365690,73138,3,"Retried the same average goalward-span signal at twice the strength so long multi-row lanes could separate more decisively from dense local clutter. The repeated-search profile still reproduced only a marginal gain versus baseline at 365690 total nodes and 73138 average nodes-per-turn at depth 3, smaller than the divisor-8 variant, so I reverted without a suite run."
2026-03-08T23:59:12-07:00,discarded,profile,working-tree,wordbase-square-word-count-saturation-threshold16-three-quarter-excess,346660,69332,3,"Changed only squareWordCountBonus in src/board.h to keep each cell linear through 16 words and then count any excess at three-quarter speed, aiming to keep GLAMORIZE-style rich spines ahead of dead cells while trimming the leverage of extremely crowded overlap pockets versus cleaner PERILLED-style lanes. The repeated-search profile regressed clearly from the 365605 baseline to 346660 total nodes and 69332 average nodes-per-turn at depth 3, so I reverted without a suite run."
2026-03-09T00:00:28-07:00,discarded,profile,working-tree,wordbase-square-word-count-saturation-threshold32-half-excess,333760,66752,3,"Changed only squareWordCountBonus in src/board.h to keep each cell linear through 32 words and then count any excess at half speed, aiming to preserve genuinely rich GLAMORIZE/PERILLED launch lanes while trimming the leverage of extremely crowded overlap pockets. The repeated-search profile regressed clearly from the 365605 baseline to 333760 total nodes and 66752 average nodes-per-turn at depth 3, so I reverted without a suite run."
2026-03-09T00:01:47-07:00,discarded,profile,working-tree,wordbase-square-word-count-cap64,289910,57982,3,"Clamped each claimed square's raw word-count contribution at 64 in src/board.h so ordinary GLAMORIZE/PERILLED-style rich lanes would stay unchanged while only the most overloaded overlap pockets lost leverage. The repeated-search profile regressed sharply from the 365605 baseline to 289910 total nodes and 57982 average nodes-per-turn at depth 3, so I reverted without a suite run."
2026-03-09T00:02:58-07:00,discarded,profile,working-tree,wordbase-square-word-count-saturation-threshold64-seven-eighths-excess,350875,70175,3,"Changed only squareWordCountBonus in src/board.h to keep each cell linear through 64 words and then count any excess at seven-eighths speed, aiming to leave ordinary GLAMORIZE/PERILLED-style rich lanes untouched while trimming only the most overcrowded duplicate-heavy pockets. The repeated-search profile still regressed from the 365605 baseline to 350875 total nodes and 70175 average nodes-per-turn at depth 3, so I reverted without a suite run."
2026-03-09T00:04:35-07:00,discarded,profile,working-tree,wordbase-square-word-count-saturation-threshold128-seven-eighths-excess,354005,70801,3,"Changed only squareWordCountBonus in src/board.h to keep each cell linear through 128 words and then count any excess at seven-eighths speed, aiming to touch only the most overloaded duplicate-heavy pockets while leaving ordinary GLAMORIZE/PERILLED-style rich lanes unchanged. The repeated-search profile still regressed from the 365605 baseline to 354005 total nodes and 70801 average nodes-per-turn at depth 3, so I reverted without a suite run."
2026-03-09T00:06:20-07:00,discarded,profile,working-tree,wordbase-square-word-count-plus-min-threshold16,16845,3369,2,"Changed only squareWordCountBonus in src/board.h to add a fixed extra premium of up to 16 words per claimed square, aiming to keep GLAMORIZE/PERILLED-style rich lanes ahead of dead cells while stopping 100-word overlap pockets from pulling far ahead on duplicate density alone. The repeated-search profile failed immediately by dropping from the 365605 baseline at depth 3 to 16845 total nodes and 3369 average nodes-per-turn at depth 2, so I reverted without a suite run."
2026-03-09T00:07:48-07:00,discarded,profile,working-tree,wordbase-square-word-count-saturation-threshold128-fifteen-sixteenths-excess,354780,70956,3,"Changed only squareWordCountBonus in src/board.h to keep each cell linear through 128 words and then discount only one-sixteenth of any excess, aiming to leave ordinary GLAMORIZE/PERILLED-style rich lanes effectively unchanged while barely trimming the most overloaded overlap pockets. Even this very gentle tail reduction still regressed the repeated-search profile from the 365605 baseline to 354780 total nodes and 70956 average nodes-per-turn at depth 3, so I reverted without a suite run."
2026-03-09T00:09:48-07:00,discarded,profile,working-tree,wordbase-square-word-count-saturation-threshold256-thirty-one-thirty-seconds-excess,365605,73121,3,"Changed only squareWordCountBonus in src/board.h to keep each cell linear through 256 words and then discount just one-thirty-second of any excess, aiming to touch only the most overloaded duplicate-heavy pockets while leaving ordinary GLAMORIZE/PERILLED-style lanes unchanged. The repeated-search profile reproduced the exact 365605 baseline with 73121 average nodes-per-turn at depth 3, so the transform was effectively inert on the benchmark board and I reverted without a suite run."
2026-03-09T00:11:08-07:00,discarded,profile,working-tree,wordbase-square-word-count-saturation-threshold192-thirty-one-thirty-seconds-excess,365605,73121,3,"Changed only squareWordCountBonus in src/board.h to keep each cell linear through 192 words and then discount just one-thirty-second of any excess, aiming to leave ordinary GLAMORIZE/PERILLED-style rich lanes untouched while barely trimming only the busiest overlap hubs. The repeated-search profile again reproduced the exact 365605 baseline with 73121 average nodes-per-turn at depth 3, so this more conservative threshold was still effectively inert on the benchmark board and I reverted without a suite run."
2026-03-09T00:12:30-07:00,discarded,profile,working-tree,wordbase-square-word-count-saturation-threshold160-thirty-one-thirty-seconds-excess,360600,72120,3,"Changed only squareWordCountBonus in src/board.h to keep each cell linear through 160 words and then discount just one-thirty-second of any excess, aiming to leave ordinary GLAMORIZE/PERILLED-style launch lanes intact while shaving only the far-tail leverage of the busiest duplicate-heavy overlap hubs. The repeated-search profile still regressed from the 365605 baseline to 360600 total nodes and 72120 average nodes-per-turn at depth 3, so even this narrow saturation hurt the benchmark board and I reverted without a suite run."
2026-03-09T00:14:06-07:00,discarded,profile,working-tree,wordbase-square-word-count-saturation-threshold176-sixty-three-sixty-fourths-excess,361465,72293,3,"Changed only squareWordCountBonus in src/board.h to keep each cell linear through 176 words and then discount just one-sixty-fourth of any excess, aiming to touch only the narrow band between the inert 192 cutoff and the regressing 160 cutoff while leaving ordinary GLAMORIZE/PERILLED-style launch lanes effectively unchanged. The repeated-search profile still regressed from the 365605 baseline to 361465 total nodes and 72293 average nodes-per-turn at depth 3, so even this nearly inert tail trim hurt the benchmark board and I reverted without a suite run."
2026-03-09T00:16:58-07:00,discarded,profile,working-tree,wordbase-square-word-count-hard-cap208,364570,72914,3,"I first inspected the README benchmark board's raw mSquareWordCounts distribution and found only one square above 224 words and only two above 192, so I tried the narrowest non-inert cap I could justify: clamp each claimed square's contribution at 208 so only the single 231-word overlap hotspot lost weight while ordinary GLAMORIZE/PERILLED-style rich lanes stayed unchanged. The repeated-search profile still regressed from the 365605 baseline to 364570 total nodes and 72914 average nodes-per-turn at depth 3, matching the older pre-goalward-reach baseline rather than the current best, so I reverted without a suite run."
2026-03-09T00:18:21-07:00,discarded,profile,working-tree,wordbase-square-word-count-saturation-threshold224-half-excess,365465,73093,3,"Changed only squareWordCountBonus in src/board.h to keep each cell linear through 224 words and then count any excess at half speed, aiming to touch only the single 231-word overlap hotspot while leaving ordinary GLAMORIZE/PERILLED-style lanes unchanged. The repeated-search profile regressed from the 365605 baseline to 365465 total nodes and 73093 average nodes-per-turn at depth 3, landing exactly on the older pre-remaining-goalward-reach baseline, so I reverted without a suite run."
2026-03-09T00:21:54-07:00,discarded,profile,working-tree,wordbase-square-word-count-saturation-threshold224-three-quarters-excess,365605,73121,3,"Changed only squareWordCountBonus in src/board.h to keep each cell linear through 224 words and then count any excess at three-quarters speed, aiming for the smallest non-inert trim to the single 231-word overlap hotspot while leaving ordinary GLAMORIZE/PERILLED-style lanes unchanged. The repeated-search profile reproduced the exact 365605 baseline with 73121 average nodes-per-turn at depth 3, so this softer saturation was effectively inert on the benchmark board and I reverted without a suite run."
2026-03-09T00:23:35-07:00,discarded,profile,working-tree,wordbase-square-word-count-saturation-threshold208-seven-eighths-excess,365480,73096,3,"Changed only squareWordCountBonus in src/board.h to keep each cell linear through 208 words and then count any excess at seven-eighths speed, aiming to leave ordinary GLAMORIZE/PERILLED-style launch lanes untouched while trimming a slightly wider far-tail band than the inert 224-threshold trials. The repeated-search profile still regressed from the 365605 baseline to 365480 total nodes and 73096 average nodes-per-turn at depth 3, so even this very small tail discount hurt the benchmark board and I reverted without a suite run."
2026-03-09T00:25:09-07:00,discarded,profile,working-tree,wordbase-square-word-count-saturation-threshold192-fifteen-sixteenths-excess,365605,73121,3,"Changed only squareWordCountBonus in src/board.h to keep each cell linear through 192 words and then count any excess at fifteen-sixteenths speed, so ordinary GLAMORIZE/PERILLED-style launch lanes stayed exact while only the two hottest overlap hubs lost a couple of points. The repeated-search profile reproduced the exact 365605 baseline with 73121 average nodes-per-turn at depth 3, so this tail trim was effectively inert on the benchmark board and I reverted without a suite run."
