timestamp,status,scenario,commit,change_ref,total_nodes,avg_nodes_per_turn,deepest_completed_depth,notes
2026-03-08T20:14:09-07:00,baseline,profile,bf81c22,steady-state-profiling-benchmark,246590,49318,3,"5 repeated searches after 2 warmup turns; benchmark from scripts/run-benchmarks.sh profile"
2026-03-08T20:14:09-07:00,kept,profile,e15793c,tt-verification-key,246590,49318,3,"Added independent TT verification key and collision regression test; no measured node change on profile baseline"
2026-03-08T20:14:09-07:00,discarded,profile,working-tree,pvs-null-window,190870,38174,3,"Principal variation search reduced repeated-search throughput versus baseline; reverted"
2026-03-08T20:14:09-07:00,discarded,profile,working-tree,tt-hash-move-ordering,174115,34823,3,"TT move-to-front ordering reduced repeated-search throughput versus baseline; reverted"
2026-03-08T20:14:09-07:00,discarded,profile,working-tree,fixed-size-tt-table,246590,49318,3,"Direct-index TT table with simple overwrite policy did not improve repeated-search node count; reverted"
2026-03-08T20:14:09-07:00,discarded,profile,working-tree,root-pv-ordering,208000,41600,3,"Iterative-deepening root preferred move ordering reduced repeated-search throughput versus baseline; reverted"
2026-03-08T20:14:09-07:00,discarded,profile,working-tree,cached-goodness-evaluation,246590,49318,3,"Incremental leaf evaluation preserved behavior but did not improve repeated-search node count; reverted"
2026-03-08T20:14:09-07:00,discarded,profile,working-tree,killer-moves,174125,34825,3,"Generic killer-move ordering reduced repeated-search throughput versus baseline; reverted"
2026-03-08T20:14:09-07:00,kept,profile,75be3ca,wordbase-path-heuristic-v1,275945,55189,3,"Added static move-ordering bonuses for word length, edge progress, and bomb contact; repeated-search baseline improved and reproduced"
2026-03-08T20:14:09-07:00,discarded,profile,working-tree,wordbase-path-heuristic-v2-edge-bonus,258010,51602,3,"Extra near-edge bonus reduced repeated-search throughput versus v1; reverted"
2026-03-08T20:14:09-07:00,discarded,profile,working-tree,wordbase-path-heuristic-v3-no-bomb-bonus,238095,47619,3,"Removing bomb and megabomb bonuses reduced repeated-search throughput versus v1; reverted"
2026-03-08T20:14:09-07:00,discarded,profile,working-tree,wordbase-path-heuristic-v4-endpoint-bonus,252465,50493,3,"Endpoint-row bonus reduced repeated-search throughput versus v1; reverted"
2026-03-08T20:14:09-07:00,discarded,profile,working-tree,wordbase-path-heuristic-v5-length24,237915,47583,3,"Increasing the length bonus above v1 reduced repeated-search throughput; reverted"
2026-03-08T20:14:09-07:00,discarded,profile,working-tree,wordbase-path-heuristic-v6-progress40,252795,50559,3,"Increasing the progress bonus above v1 reduced repeated-search throughput; reverted"
2026-03-08T20:14:09-07:00,discarded,profile,working-tree,wordbase-path-heuristic-v7-progress24,275140,55028,3,"Lowering the progress bonus was close to v1 but still slightly worse; reverted"
2026-03-08T20:14:09-07:00,discarded,profile,working-tree,wordbase-path-heuristic-v8-bomb64,264610,52922,3,"Lowering bomb and megabomb bonuses reduced repeated-search throughput versus v1; reverted"
2026-03-08T20:14:09-07:00,discarded,profile,working-tree,wordbase-path-heuristic-v9-span24,238185,47637,3,"Forward-span bonus reduced repeated-search throughput versus v1; reverted"
2026-03-08T20:14:09-07:00,discarded,profile,working-tree,recordOne-already-owned-early-return,275945,55189,3,"Skipping already-owned cells in recordOne preserved behavior but did not improve the repeated-search baseline"
2026-03-08T20:14:09-07:00,discarded,profile,working-tree,recordOne-iterative-propagation,275945,55189,3,"Iterative bomb propagation in recordOne preserved behavior but did not improve the repeated-search baseline; reverted"
2026-03-08T20:14:09-07:00,discarded,profile,working-tree,dynamic-front-window-ordering,187145,37429,3,"State-aware front-window reranking by claimable and enemy path cells reduced repeated-search throughput badly versus v1; reverted"
2026-03-08T20:14:09-07:00,discarded,profile,working-tree,wordbase-square-mobility-divisor8,261675,52335,3,"Adding a weak future-mobility bonus from per-square legal-word counts underperformed the stronger variants"
2026-03-08T20:14:09-07:00,discarded,profile,working-tree,wordbase-square-mobility-divisor4,277530,55506,3,"A moderate future-mobility bonus improved profile slightly but was dominated by stronger scaling"
2026-03-08T20:14:09-07:00,discarded,profile,working-tree,wordbase-square-mobility-divisor2,278125,55625,3,"A stronger future-mobility bonus improved profile but still underperformed divisor1"
2026-03-08T20:14:09-07:00,kept,profile,working-tree,wordbase-square-mobility-divisor1,339260,67852,3,"Added a per-square future-mobility bonus from legal-word counts across the claimed path; profile rose from 275945 to 339260 and short rose from 81916 to 84370"
2026-03-08T20:14:09-07:00,discarded,profile,working-tree,depth-based-move-cap-120-60,122100,24420,3,"Shrinking the move cap aggressively by ply cut away too much search and reduced both short and repeated-search benchmarks"
2026-03-08T20:14:09-07:00,discarded,profile,working-tree,wordbase-forward-mobility-bonus-32,337075,67415,3,"Extra forward-weighted mobility on top of raw mobility improved short slightly but lost on repeated search"
2026-03-08T20:14:09-07:00,discarded,profile,working-tree,wordbase-future-diversity-divisor8,339725,67945,3,"A weak future-move diversity bonus was worse than the stronger diversity variants"
2026-03-08T20:14:09-07:00,discarded,profile,working-tree,wordbase-future-diversity-divisor4,345410,69082,3,"A moderate future-move diversity bonus improved on raw mobility but was beaten by divisor2"
2026-03-08T20:14:09-07:00,discarded,profile,working-tree,wordbase-future-diversity-divisor1,22785,4557,2,"Overweighting future-move diversity collapsed the search and dropped completed depth"
2026-03-08T20:14:09-07:00,kept,profile,working-tree,wordbase-future-diversity-divisor2,354475,70895,3,"Added a future-move diversity bonus based on unique legal starts unlocked by the claimed path; profile rose from 339260 to 354475 and short rose to 87822"
2026-03-08T20:14:09-07:00,discarded,profile,working-tree,tt-hash-move-ordering-retest,182050,36410,3,"TT hash-move ordering still reduced throughput badly even after the stronger Wordbase ordering baseline; reverted"
2026-03-08T20:14:09-07:00,discarded,profile,working-tree,wordbase-deep-diversity-frontier,221088,44217,3,"Biasing diversity toward the deepest claimed cells looked promising in one run but was not repeatable and was reverted"
2026-03-08T20:14:09-07:00,discarded,profile,working-tree,wordbase-peak-anchor-quality,81955,16391,2,"Using the best future word from claimed anchors overfit flashy lines and collapsed repeated-search depth"
2026-03-08T20:14:09-07:00,discarded,profile,working-tree,wordbase-long-word-count,17775,3555,2,"Counting long future words per square was another unstable anchor-quality signal and was reverted"
2026-03-08T20:14:09-07:00,kept,profile,working-tree,wordbase-long-future-diversity,364230,72846,3,"Added a long-word diversity bonus so paths preserving many distinct long threats are ordered earlier; profile rose from 354475 to 364230"
2026-03-08T21:21:32-07:00,kept,profile,0ca2b91,find-first-renumbered-goodness,364230,72846,3,Use_find_first_no_behavior_change
2026-03-08T21:22:25-07:00,discarded,profile,working-tree,wordbase-bend-penalty-k8,363915,72783,3,"Added a small bend penalty to prefer straighter lanes; repeated-search nodes regressed slightly vs baseline 364230 so reverting"
2026-03-08T21:23:04-07:00,discarded,profile,working-tree,endpoint-anchor-bonus-divisor6,364230,72846,3,No measurable change versus baseline; reverted to divisor8
2026-03-08T21:23:16-07:00,kept,profile,working-tree,wordbase-letter-rarity-target6-divisor2,364270,72854,3,"Added a rare-letter tie-breaker favoring paths that claim scarce letters (e.g., the lone 'z' along GLAMORIZE). On the profile scenario total_nodes rose from 364230 to 364270 and deepest_completed_depth stayed 3; effect is tiny but repeatable."
2026-03-08T21:23:30-07:00,discarded,profile,working-tree,wordbase-neighborhood-halo-divisor48,18005,3601,2,"Added a very weak 8-neighbor halo bonus; repeated-search depth collapsed from 3 to 2, so reverting"
2026-03-08T21:26:45-07:00,discarded,profile,working-tree,wordbase-neighborhood-max-halo-k96,364230,72846,3,Added a max-halo neighborhood tie-breaker (3x3 local mobility, single best cell per path) with a stiff divisor; profile repeated-search nodes unchanged vs baseline so reverting
2026-03-08T21:27:14-07:00,discarded,profile,working-tree,wordbase-letter-rarity-target6-divisor2,364230,72846,3,"After implementing the rare-letter tie-breaker, repeated-search totals matched baseline (no throughput or depth change). Keeping tree clean and reverting."
2026-03-08T21:31:51.827024-07:00,discarded,profile,working-tree,wordbase-row-band-diversity-weight8,364230,72846,3,"Added a row-band diversity bonus that rewards paths spanning many distinct rows (e.g., GLAMORIZE diagonal vs GLASS horizontal). Repeated-search totals unchanged vs baseline; reverting."
2026-03-08T21:34:17-07:00,discarded,profile,working-tree,wordbase-column-band-diversity-weight8,364230,72846,3,"Added a small column-band diversity bonus so diagonals like GLAMORIZE beat one-file paths like EEL when other signals tie. Repeated-search totals reproduced exactly at baseline, so reverting."
2026-03-08T21:35:19-07:00,discarded,profile,working-tree,wordbase-frontier-square-word-count-divisor6,364230,72846,3,"Added a frontier mobility bonus from unique neighboring squares around the claimed path (e.g., GLAMORIZE leaves side shoulders; EEL mostly stacks starts on one file). At divisor 6 the repeated-search profile stayed exactly at baseline, so trying a stronger scaling."
2026-03-08T21:35:51-07:00,discarded,profile,working-tree,wordbase-frontier-square-word-count-divisor2,345895,69179,3,"Strengthening the frontier neighboring-word-count bonus reordered search in the wrong direction: repeated-search profile fell from 364230 to 345895 while depth stayed 3. Reverting that scaling and trying a less correlated frontier signal."
2026-03-08T21:36:25-07:00,discarded,profile,working-tree,wordbase-frontier-square-count-weight12,340310,68062,3,"Switched to a geometry-only frontier count that rewards paths exposing many neighboring squares. It was even noisier: repeated-search profile fell to 340310 with no extra depth, so reverting to the known-good baseline."
2026-03-08T21:39:08-07:00,discarded,profile,working-tree,wordbase-future-word-text-diversity-divisor4,364230,72846,3,"Counted distinct future word texts so a lane leaving {stare, stern, stone} would outrank one mostly preserving repeated GLAMORIZE placements. At divisor 4 the repeated-search profile matched the 364230 baseline exactly, so reverting."
2026-03-08T21:39:08-07:00,discarded,profile,working-tree,wordbase-future-word-text-diversity-divisor2,364230,72846,3,"Strengthening the distinct future word-text bonus still produced the exact 364230 repeated-search profile total with depth 3. The text-level signal was too correlated with the existing mobility/diversity stack, so reverting."
2026-03-08T21:41:42-07:00,discarded,profile,working-tree,wordbase-future-progress-row-coverage-weight8,17760,3552,2,"Rewarded paths whose future follow-ups land on several forward rows instead of one band. That reordered the profile position badly enough to stall at depth 2 on every repeated search, so reverting."
2026-03-08T21:42:52-07:00,discarded,profile,working-tree,wordbase-future-start-square-coverage-weight6,18005,3601,2,"Rewarded paths that preserved many distinct future start squares. That favored noisy multi-anchor clutter over the baseline ordering and every repeated search stalled at depth 2, so reverting."
2026-03-08T21:43:36-07:00,discarded,profile,working-tree,wordbase-long-future-start-square-coverage-weight8,18005,3601,2,"Restricted the start-square coverage bonus to long follow-ups only, hoping to favor separate long-threat anchors. It still shoved the profile search into the same bad depth-2 ordering, so reverting."
2026-03-08T21:47:48-07:00,discarded,profile,working-tree,wordbase-long-square-word-count-divisor4,17775,3555,2,"Summed per-square counts of long words along the claimed path so the middle of a GLAMORIZE lane would outrank side squares that mostly feed GLASS. The signal was far too strong: repeated-search depth fell from 3 to 2, so reverting."
2026-03-08T21:47:48-07:00,kept,profile,working-tree,wordbase-square-forward-reach-divisor4,364570,72914,3,"Added a small per-square forward-reach bonus based on the average depth of words through each claimed cell, so lanes used by deeper attacks like PERILLED break ties over squares whose words stall locally. The repeated-search profile improved reproducibly from 364230 to 364570 in two runs, and short held at 87981."
2026-03-08T22:04:02-07:00,discarded,profile,working-tree,wordbase-square-forward-tail-reach-divisor4,17775,3555,2,"Changed the retained square forward-reach signal to count only rows still ahead of each claimed square, hoping middle cells on lanes like PERILLED or GLAMORIZE would beat late squares that are already deep. That stripped too much correlation with raw progress: repeated-search profile collapsed from 364570 to 17775 and stalled at depth 2, so reverting."
2026-03-08T22:25:35-07:00,discarded,profile,working-tree,wordbase-gated-rare-letter-by-forward-reach-average,364390,72878,3,"Gated rare-letter credit so only squares above the board's average forward reach contributed, aiming to keep the GLAMORIZE-style Z bonus while muting shallow side-branch junk. Repeated-search profile slipped from the retained 364570 baseline to 364390 at the same depth 3, so reverting without a suite run."
2026-03-08T22:28:15-07:00,discarded,profile,working-tree,wordbase-rarity-forward-reach-excess-divisor12,364570,72914,3,"Scaled each rare-letter tie-breaker by how far the claimed square's forward reach sat above the board average, so deep-lane rares like the GLAMORIZE z kept some credit while shallow side branches lost it. Repeated-search profile reproduced the exact 364570 baseline in all five runs, so reverting as flat."
2026-03-08T22:31:12-07:00,discarded,profile,working-tree,wordbase-consistent-forward-reach-cells-average-plus1-divisor2,364570,72914,3,"Counted claimed cells whose forward-reach score cleared the board average plus one row, then gave a tiny bonus only when a path had several such cells so uniform lanes like PERILLED could beat mixed paths with one strong GLAMORIZE anchor. Repeated-search profile matched the 364570 baseline in all five runs, so reverting as flat."
2026-03-08T22:33:10-07:00,discarded,profile,working-tree,wordbase-forward-reach-excess-above-board-average-divisor12,364200,72840,3,"Summed only the forward-reach excess above the board-wide average for each claimed cell, hoping lanes with several strong interior squares like PERILLED would beat paths carried by one GLAMORIZE-style anchor. Repeated-search profile dropped reproducibly from 364570 to 364200 in all five runs at depth 3, so reverting without a suite run."
2026-03-08T22:35:03-07:00,discarded,profile,working-tree,wordbase-consistent-forward-reach-cells-average-divisor2,291735,58347,3,"Added a gated consistency bonus for paths with at least two cells at or above the board-average forward-reach score, hoping uniformly strong lanes like PERILLED would beat a GLAMORIZE anchor padded by shallow cleanup cells. The repeated-search profile became unstable immediately: one measured run dropped to depth 2 and the total fell well below the 364570 baseline, so reverting without a suite run."
2026-03-08T22:36:37-07:00,discarded,profile,working-tree,wordbase-consistent-forward-reach-at-least3-average-fixed1,364350,72870,3,"Added a one-point tie-breaker when a path had at least three cells at or above the board-average forward-reach score, aiming to reward uniform lanes like PERILLED over lines carried by one GLAMORIZE anchor. Repeated-search profile slipped from the 364570 baseline to 364350 at depth 3, so reverting without a suite run."
2026-03-08T22:38:07-07:00,discarded,profile,working-tree,wordbase-consistent-forward-reach-at-least2-average-plus1-fixed1,294883,58976.6,3,"Added a one-point tie-breaker when at least two claimed cells cleared board-average forward reach plus one row, trying to reward genuinely strong interior lanes like PERILLED without crediting a single GLAMORIZE anchor. The repeated-search profile became unstable again: one measured run fell to depth 2 and the total collapsed far below the 364570 baseline, so reverting without a suite run."
2026-03-08T22:40:11-07:00,discarded,profile,working-tree,wordbase-consistent-forward-reach-at-least4-average-fixed1,295047,59009.4,3,"Added a one-point tie-breaker when at least four claimed cells met the board-average forward-reach score, aiming to reward uniformly deep lanes like PERILLED over paths carried by a single GLAMORIZE anchor. The repeated-search profile became unstable immediately: one measured run fell to depth 2 and total_nodes collapsed well below the 364570 baseline, so reverting without a suite run."
2026-03-08T22:42:01-07:00,discarded,profile,working-tree,wordbase-square-word-count-half-credit-below-forward-reach2,87711,17542.2,3,"Gated each square-word-count contribution so cells with forward reach under two rows only kept half credit, aiming to preserve GLAMORIZE/PERILLED lanes while damping EEL-style cleanup pockets. The first profile run looked strong at 367935 total nodes, but the immediate rerun became unstable with four repeated-search turns falling to depth 2 and total_nodes collapsing to 87711, so reverting without a suite run."
2026-03-08T22:43:28-07:00,discarded,profile,working-tree,wordbase-square-word-count-smooth-forward-reach-discount,344330,68866,3,"Discounted each square-word-count contribution by a smooth function of that cell's side-to-move forward reach, so reach-0 cleanup pockets like EEL kept half credit while deeper GLAMORIZE/PERILLED cells kept more. The repeated-search profile was a clear depth-3 regression from the 364570 baseline, so reverting without a suite run."
2026-03-08T22:44:22-07:00,discarded,profile,working-tree,wordbase-square-word-count-half-credit-only-at-forward-reach0,225756,45151.2,3,"Only halved square-word-count credit on cells whose side-to-move forward reach was exactly zero, intending to hit dead-end EEL-style cleanup pockets without touching reach-1+ GLAMORIZE/PERILLED lanes. The repeated-search profile became unstable anyway, with two measured turns dropping to depth 2, so reverting without a suite run."
2026-03-08T22:46:39-07:00,discarded,profile,working-tree,wordbase-square-goalward-next-step-branching-divisor2,361790,72358,3,"Added a small goalward-only next-step branching bonus from each claimed start square, counting distinct non-retreating continuations so PERILLED/INTERROBANG-style lanes could beat sideways cleanup starts like EEL. The repeated-search profile was stable but slipped from the 364570 baseline to 361790 total nodes, so reverting without a suite run."
2026-03-08T22:51:01-07:00,kept,profile-suite,working-tree,wordbase-square-goalward-excess-next-step-branching-divisor2,365465,73093,3,"Counted only excess goalward next-step fanout per claimed square, so ordinary single-lane continuations stayed neutral while PERILLED/INTERROBANG-style branch points still broke ties over EEL-style cleanup pockets. The repeated-search profile improved reproducibly from 364570 to 365465 at depth 3, and profile-suite also improved overall: readme-main 364570->365465, driver-sample-a 298205->304875, driver-sample-b 2010->1960."
2026-03-08T22:52:36-07:00,discarded,profile,working-tree,wordbase-square-goalward-excess-next-step-branching-divisor1,364880,72976,3,"Tried doubling the weight of the kept excess goalward next-step fanout signal so PERILLED/INTERROBANG-style branch points would break ties more aggressively over EEL-style cleanup pockets. The repeated-search profile stayed stable at depth 3 but slipped from the 365465 baseline to 364880 total nodes, so reverting without a suite run."
2026-03-08T22:54:03-07:00,discarded,profile,working-tree,wordbase-square-goalward-excess-next-step-strict-row-advance-divisor2,364730,72946,3,"Tightened the kept excess goalward next-step fanout signal so only row-advancing continuations counted, aiming to keep PERILLED-style forward forks while dropping same-row EEL cleanups. The repeated-search profile stayed stable at depth 3 but slipped from the 365465 baseline to 364730 total nodes, so reverting without a suite run."
2026-03-08T22:55:27-07:00,discarded,profile,working-tree,wordbase-square-goalward-excess-next-step-deeper-destination-divisor2,363945,72789,3,"Required each counted goalward next-step branch to land on a square whose own average forward reach still extended beyond that landing row, aiming to keep PERILLED-style deeper forks while filtering EEL-style cleanup branches that immediately peter out. The repeated-search profile stayed stable at depth 3 but regressed from the 365465 baseline to 363945 total nodes, so reverting without a suite run."
2026-03-08T23:01:16-07:00,discarded,profile,working-tree,wordbase-policy-overlay-default-weights-prototype,22955,4591,2,"Prototype cached policy-overlay move ordering with disk-loaded default weights over broad static signals such as progress, forward reach, goalward branching, and long-fork diversity. The repeated-search profile collapsed immediately from the 365465 baseline to 22955 total nodes and every measured turn fell to depth 2, so reverting without a suite run."
