timestamp,status,scenario,commit,change_ref,total_nodes,avg_nodes_per_turn,deepest_completed_depth,notes
2026-03-08T23:16:02-07:00,discarded,profile,working-tree,wordbase-policy-prefix-exact-tie-bubbles,295163,59032.6,3,"Tightened the optional policy overlay so it only broke exact heuristic ties inside the top-12 prefix, keeping the same broad static features from the cached table. The first four repeated searches stayed at depth 3 but the fifth still slipped to depth 2, leaving the profile summary well below the 364570 / 72914 / depth 3 baseline at 295163 / 59032.6 / depth 3, so reverting without running profile-suite."
2026-03-08T23:08:54-07:00,discarded,profile,working-tree,wordbase-square-text-diversity-divisor16,17770,3554,2,"Added a tiny per-square bonus for how many distinct word texts pass through each claimed cell, hoping broad lexical hubs would beat clusters inflated by duplicate path variants of the same word family. The repeated-search profile immediately flipped to INTERROBANG and collapsed from the 364570 / 72914 / depth 3 baseline to 17770 / 3554 / depth 2, so reverting without running profile-suite."
2026-03-08T23:16:30-07:00,discarded,profile,working-tree,wordbase-policy-table-equal-goodness-tiebreak,364630,72926,3,"Added an optional on-disk static policy stub that scored each legal word from broad board-derived features and only broke exact goodness ties during renumbering. The repeated-search profile improved reproducibly from 364570 / 72914 / depth 3 to 364630 / 72926 / depth 3, but profile-suite regressed driver-sample-a from 298205 to 298045 and slipped the suite average total nodes from 221595 to 221561.67, so reverting."
2026-03-08T23:18:43-07:00,discarded,profile,working-tree,wordbase-square-long-word-count-divisor8,364095,72819,3,"Added a small per-square bonus for how many long legal words (length >= 8) pass through each claimed cell, so lanes shared by attacks like INTERROBANG or GLAMORIZE would edge out squares whose traffic is mostly short cleanup words like EEL. The repeated-search profile regressed cleanly from the 364570 / 72914 / depth 3 baseline to 364095 / 72819 / depth 3, so reverting without running profile-suite."
2026-03-09T00:00:00-08:00,kept,profile,working-tree,wordbase-raw-feature-exact-goodness-tiebreak,364630,72926,3,"Stored the raw versions of the existing diversity and forward-reach signals, then used them only to break exact heuristic ties caused by integer division. On profile the repeated searches improved reproducibly from 364570 / 72914 / depth 3 to 364630 / 72926 / depth 3, and profile-suite improved overall without regressing any board (readme-main 364630, driver-sample-a 298205, driver-sample-b 2010; suite avg_total_nodes 221615.00)."
2026-03-09T00:00:00-08:00,kept,profile-suite,working-tree,wordbase-raw-feature-exact-goodness-tiebreak,664845,44323,4,"Suite verification for the exact-goodness raw-feature tie-break: readme-main 364630, driver-sample-a 298205, driver-sample-b 2010, suite avg_total_nodes 221615.00 and no board regressed versus the retained baseline."
2026-03-08T23:25:57-07:00,discarded,profile,working-tree,wordbase-optional-policy-weights-final-tiebreak,364630,72926,3,"Added an optional disk-backed policy-weight stub that scored broad per-square averages like forward reach and future diversity, but only as the final tie-break after the retained raw-feature ordering. The repeated-search profile came back exactly flat at 364630 / 72926 / depth 3, so reverting without running profile-suite."
2026-03-08T23:28:43-07:00,discarded,profile,working-tree,wordbase-raw-progress-length-final-tiebreak,364630,72926,3,"Cached raw goal-progress and word-length values and used them only after the retained raw diversity/reach tie-breakers, so lanes that actually reached farther would beat same-score paths that stopped earlier. The repeated-search profile came back exactly flat at 364630 / 72926 / depth 3, so reverting without running profile-suite."
2026-03-08T23:32:47-07:00,discarded,profile,working-tree,wordbase-policy-weights-after-raw-diversity,364630,72926,3,"Added an optional disk-loaded policy-weight stub that attached per-word float scores from broad static features like progress, forward reach, diversity, and bomb access, then used it only after the retained raw diversity tie-breakers. The repeated-search profile came back exactly flat at 364630 / 72926 / depth 3, so reverting without running profile-suite."
2026-03-08T23:35:21-07:00,discarded,profile,working-tree,wordbase-future-word-text-exact-tiebreak,360650,72130,3,"Added an exact-goodness tie-break that counted distinct future word texts, so three equivalent GLAMORIZE routes would not outrank a lane that kept both GLAMORIZE and STARE alive. The repeated-search profile regressed cleanly from the retained 364630 / 72926 / depth 3 baseline to 360650 / 72130 / depth 3, so reverting without running profile-suite."
2026-03-08T23:39:44-07:00,discarded,profile,working-tree,wordbase-static-policy-overlay-final-tiebreak,364630,72926,3,"Added an optional disk-loaded static policy overlay that turned broad board features like average forward reach, diversity, and bomb access into a float per-move score, but only as the final tie-break after the retained raw-feature ordering. With WORDBASE_POLICY_WEIGHTS_FILE=src/policy-weights-static.txt, the repeated-search profile came back exactly flat at 364630 / 72926 / depth 3, so reverting without running profile-suite."
2026-03-08T23:44:48-07:00,discarded,profile,working-tree,wordbase-static-policy-overlay-before-raw-tiebreak,364630,72926,3,"Added an optional disk-loaded static policy overlay that attached broad per-move scores from progress, forward reach, diversity, and bomb access, then used it immediately after the base integer heuristic before the retained raw exact-goodness tie-breakers. With WORDBASE_POLICY_WEIGHTS_FILE=src/policy-weights-static.txt, the repeated-search profile stayed exactly flat at 364630 / 72926 / depth 3, so reverting without running profile-suite."
2026-03-08T23:48:24-07:00,discarded,profile,working-tree,wordbase-killer-history-lmr-conservative,8340,1668,3,"Added per-ply killer slots, a player-scoped history table layered after the existing static Wordbase order, and a conservative late-move reduction for late non-TT/non-killer moves. The repeated-search profile collapsed from the retained 364630 / 72926 / depth 3 baseline to 8340 / 1668 / depth 3, so reverting without running profile-suite."
2026-03-08T23:52:36-07:00,discarded,profile,working-tree,wordbase-future-progress-exact-tiebreak,364630,72926,3,"Added a player-specific exact-goodness tie-break that summed the goal progress of distinct preserved follow-up words, so moves keeping deeper continuations like PERILLED-style lanes could beat equally diverse lanes whose surviving words stalled near short pockets like EEL. The repeated-search profile was bit-for-bit identical to the retained 364630 / 72926 / depth 3 baseline, so reverting without running profile-suite."
2026-03-08T23:54:25-07:00,discarded,profile,working-tree,wordbase-square-word-count-soft-cap-8,339940,67988,3,"Applied diminishing returns to each square's raw legal-word count with an 8-point soft cap plus half-overflow, so GLAMORIZE-style spine cells still scored well but overloaded local clusters stopped scaling linearly. The repeated-search profile regressed clearly from the retained 364630 / 72926 / depth 3 baseline to 339940 / 67988 / depth 3, so reverting without running profile-suite."
2026-03-08T23:56:21-07:00,discarded,profile,working-tree,wordbase-average-square-word-density-final-tiebreak,364630,72926,3,"Added a final exact-goodness tie-break that preferred higher average per-cell word density when total square traffic was equal, so a uniformly active GLAMORIZE-style lane could beat a route that got the same total from one crowded hub plus dead cells. The repeated-search profile was bit-for-bit identical to the retained 364630 / 72926 / depth 3 baseline, so reverting without running profile-suite."
2026-03-08T23:57:54-07:00,discarded,profile,working-tree,wordbase-square-word-count-overflow-start-16-three-quarters,347315,69463,3,"Applied a gentler diminishing-returns transform to per-square legal-word counts by keeping counts linear through 16 and then crediting only three quarters of further overflow, so GLAMORIZE-style spine cells still stayed strong while overloaded local hubs lost some duplicate-heavy weight. The repeated-search profile regressed clearly from the retained 364630 / 72926 / depth 3 baseline to 347315 / 69463 / depth 3, so reverting without running profile-suite."
2026-03-08T23:59:35-07:00,discarded,profile,working-tree,wordbase-square-word-count-overflow-start-32-seven-eighths,353670,70734,3,"Kept per-square legal-word counts linear through 32 and then credited seven eighths of overflow, aiming to preserve GLAMORIZE-style spines while shaving only a little value from overloaded local hubs. The repeated-search profile still regressed from the retained 364630 / 72926 / depth 3 baseline to 353670 / 70734 / depth 3, so reverting without running profile-suite."
2026-03-09T00:02:17-07:00,discarded,profile,working-tree,wordbase-square-word-count-overflow-start-160-fifteen-sixteenths,360045,72009,3,"Kept per-square legal-word counts linear through 160 and then credited fifteen sixteenths of overflow, so ordinary GLAMORIZE-style spine squares stayed untouched while only the busiest duplicate-heavy hubs lost a sliver of weight. The repeated-search profile still regressed from the retained 364630 / 72926 / depth 3 baseline to 360045 / 72009 / depth 3, so reverting without running profile-suite."
2026-03-09T00:03:32-07:00,discarded,profile,working-tree,wordbase-square-word-count-overflow-start-192-seven-eighths,364490,72898,3,"Kept per-square legal-word counts linear through 192 and then credited seven eighths of overflow, so standard GLAMORIZE- or PERILLED-style lane squares stayed untouched while only the busiest 200+ duplicate-heavy hubs lost a little weight. The repeated-search profile still slipped from the retained 364630 / 72926 / depth 3 baseline to 364490 / 72898 / depth 3, so reverting without running profile-suite."
2026-03-09T00:04:55-07:00,discarded,profile,working-tree,wordbase-square-word-count-overflow-start-224-minus-one-per-16,364630,72926,3,"Applied an extremely conservative diminishing-returns transform that kept per-square legal-word counts linear through 224 and then removed only one point per additional block of 16 overflow words, so normal GLAMORIZE- or PERILLED-style lane squares were unchanged while only the most duplicate-heavy 240+ hubs could lose a couple of points. The repeated-search profile was bit-for-bit identical to the retained 364630 / 72926 / depth 3 baseline, so reverting without running profile-suite."
2026-03-09T00:06:40-07:00,discarded,profile,working-tree,wordbase-square-word-count-bonus-only-overflow-start-224-half,364490,72898,3,"Applied a very late diminishing-returns transform only to the heuristic-facing square-word-count bonus, keeping the raw per-path totals for exact tie-breaking while shaving half of any per-square overflow above 224. The repeated-search profile still regressed from the retained 364630 / 72926 / depth 3 baseline to 364490 / 72898 / depth 3, so reverting without running profile-suite."
2026-03-09T00:08:27-07:00,discarded,profile,working-tree,wordbase-square-word-count-bonus-only-overflow-start-224-seven-eighths,364630,72926,3,"Applied a very late diminishing-returns transform only to the heuristic-facing square-word-count bonus, keeping the raw per-path totals for exact tie-breaking while crediting seven eighths of any per-square overflow above 224. The repeated-search profile was bit-for-bit identical to the retained 364630 / 72926 / depth 3 baseline, so reverting without running profile-suite."
2026-03-09T00:10:47-07:00,discarded,profile,working-tree,wordbase-square-word-count-bonus-only-cap-224,364390,72878,3,"Capped each square's contribution to the heuristic-only square-word-count bonus at 224 while keeping the raw per-path total for exact tie-breaking, aiming to leave GLAMORIZE- or PERILLED-style lanes intact while muting only the most overloaded duplicate-heavy hubs. The repeated-search profile regressed from the retained 364630 / 72926 / depth 3 baseline to 364390 / 72878 / depth 3, so reverting without running profile-suite."
2026-03-09T00:12:56-07:00,discarded,profile,working-tree,wordbase-square-word-count-bonus-only-overflow-start-128-half,346135,69227,3,"Changed only the heuristic-facing per-square bonus to keep counts linear through 128 and then credit half of further overflow, while preserving the raw path total for exact tie-breaking. That broad taper heavily underweighted strong GLAMORIZE- or PERILLED-style lane squares along with the noisy hubs, and the repeated-search profile regressed sharply from the retained 364630 / 72926 / depth 3 baseline to 346135 / 69227 / depth 3, so reverting without running profile-suite."
2026-03-09T00:14:53-07:00,discarded,profile,working-tree,wordbase-square-word-count-bonus-only-overflow-start-240-half,364630,72926,3,"Changed only the heuristic-facing per-square bonus to keep counts linear through 240 and then credit half of any further overflow, while preserving the raw path total for exact tie-breaking. The repeated-search profile was bit-for-bit identical to the retained 364630 / 72926 / depth 3 baseline, so reverting without running profile-suite."
2026-03-09T00:16:12-07:00,discarded,profile,working-tree,wordbase-square-word-count-bonus-only-overflow-start-224-three-quarters,364490,72898,3,"Changed only the heuristic-facing per-square bonus to keep counts linear through 224 and then credit three quarters of any further overflow, while preserving the raw path total for exact tie-breaking. That still shaved enough value off the busiest duplicate-heavy hubs to reproduce the same repeated-search regression as the harsher late-overflow variants: profile fell from the retained 364630 / 72926 / depth 3 baseline to 364490 / 72898 / depth 3, so reverting without running profile-suite."
2026-03-09T00:18:07-07:00,discarded,profile,working-tree,wordbase-square-word-count-bonus-only-quadratic-tail-start-192-div512,364490,72898,3,"Changed only the heuristic-facing per-square word-count bonus to stay linear through 192 and then subtract a smooth quadratic tail from heavier overflow, so ordinary GLAMORIZE- or PERILLED-style lane squares stayed untouched while only the most duplicate-heavy hubs lost more noticeable credit. The repeated-search profile reproduced the same regression as the harsher late-overflow variants, falling from the retained 364630 / 72926 / depth 3 baseline to 364490 / 72898 / depth 3, so reverting without running profile-suite."
2026-03-09T00:19:59-07:00,discarded,profile,working-tree,wordbase-square-word-count-bonus-only-overflow-start-192-minus-one-per-16,364490,72898,3,"Changed only the heuristic-facing per-square bonus to stay linear through 192 and then shave one point per additional block of 16 overflow words, while preserving the raw per-path total for exact tie-breaking. Even that narrow trim still reproduced the same repeated-search regression as the other 192-threshold variants, dropping from the retained 364630 / 72926 / depth 3 baseline to 364490 / 72898 / depth 3, so reverting without running profile-suite."
2026-03-09T00:22:26-07:00,discarded,profile,working-tree,wordbase-square-word-count-bonus-only-overflow-start-216-seven-eighths,364490,72898,3,"Changed only the heuristic-facing per-square bonus to keep counts linear through 216 and then credit seven eighths of further overflow, while preserving the raw path total for exact tie-breaking. That still trimmed enough value from heavily reused hub squares to reproduce the same repeated-search regression as the harsher 192- and 224-threshold variants, falling from the retained 364630 / 72926 / depth 3 baseline to 364490 / 72898 / depth 3, so reverting without running profile-suite."
2026-03-09T00:24:21-07:00,discarded,profile,working-tree,wordbase-square-word-count-bonus-only-plus-half-capped-64,21280,4256,2,"Tried a capped additive transform only for the heuristic-facing per-square bonus: each claimed cell kept its raw count plus up to 64 extra points from half the count, aiming to separate cleaner 60- to 120-word lanes without letting 240-word hubs dominate indefinitely. That reweighted the feature far too aggressively, flipping the repeated-search principal variation to INTERROBANG and dropping profile from the retained 364630 / 72926 / depth 3 baseline to 21280 / 4256 / depth 2, so reverting immediately without running profile-suite."
2026-03-09T00:26:28-07:00,discarded,profile,working-tree,wordbase-square-word-count-bonus-only-overflow-start-232-flat-minus-one,364630,72926,3,"Changed only the heuristic-facing per-square bonus to leave each cell linear through 232 and then charge a flat one-point penalty above that, aiming to touch only the most overloaded duplicate-heavy hubs while leaving ordinary GLAMORIZE- or PERILLED-style lane squares unchanged. The repeated-search profile was bit-for-bit identical to the retained 364630 / 72926 / depth 3 baseline, so treating it as flat and reverting without running profile-suite."
2026-03-09T00:27:49-07:00,discarded,profile,working-tree,wordbase-square-word-count-bonus-only-overflow-start-240-quarter-tail,364630,72926,3,"Changed only the heuristic-facing per-square bonus to keep each cell linear through 240 and then credit only one quarter of further overflow, aiming to touch just the busiest duplicate-heavy hubs while leaving ordinary GLAMORIZE- or PERILLED-style lane squares untouched. The repeated-search profile was bit-for-bit identical to the retained 364630 / 72926 / depth 3 baseline, so treating it as flat and reverting without running profile-suite."
2026-03-09T00:29:39-07:00,discarded,profile,working-tree,wordbase-square-word-count-bonus-only-overflow-start-208-fifteen-sixteenths,364490,72898,3,"Changed only the heuristic-facing per-square bonus to keep counts linear through 208 and then shave just one point per additional block of 16 overflow words, aiming to touch only the busiest duplicate-heavy hubs while leaving ordinary GLAMORIZE- or PERILLED-style lane squares fully intact. The repeated-search profile reproduced the same regression as the harsher late-overflow variants, dropping from the retained 364630 / 72926 / depth 3 baseline to 364490 / 72898 / depth 3, so reverting without running profile-suite."
2026-03-09T00:34:20-07:00,discarded,profile,working-tree,wordbase-square-word-count-bonus-only-minus-one-sixty-fourth-per-cell,359950,71990,3,"Changed only the heuristic-facing per-square bonus to subtract each claimed cell's count divided by 64, spreading a tiny compression across all busy squares instead of clipping only the single 231-word hotspot on readme-main. The board distribution check showed most live cells sit far below the earlier 192-plus thresholds, but this broader trim still flipped the repeated-search profile back to INTERROBANG and regressed from the retained 364630 / 72926 / depth 3 baseline to 359950 / 71990 / depth 3, so reverting without running profile-suite."
2026-03-09T00:36:06-07:00,discarded,profile,working-tree,wordbase-square-word-count-bonus-only-overflow-start-160-minus-one-per-48,364630,72926,3,"Changed only the heuristic-facing per-square bonus to subtract one point for each additional block of 48 words above 160 on a claimed cell, so ordinary 40- to 160-word GLAMORIZE- or PERILLED-style lane squares stayed fully linear while genuinely crowded 208-plus hubs lost at most a point. The repeated-search profile was bit-for-bit identical to the retained 364630 / 72926 / depth 3 baseline, including the INTERROBANG principal variation, so treating it as flat and reverting without running profile-suite."
2026-03-09T00:38:09-07:00,discarded,profile,working-tree,wordbase-square-word-count-bonus-only-minus-one-one-hundred-twenty-eighth-per-cell,364220,72844,3,"Changed only the heuristic-facing per-square bonus to subtract each claimed cell's count divided by 128, aiming for a milder global taper that left ordinary 40- to 120-word GLAMORIZE-style lane squares nearly linear while trimming one point from genuinely crowded 128-plus hubs. Even this lighter whole-board compression still regressed the repeated-search profile from the retained 364630 / 72926 / depth 3 baseline to 364220 / 72844 / depth 3 and switched the principal variation back to INTERROBANG, so reverting without running profile-suite."
2026-03-09T00:39:44-07:00,discarded,profile,working-tree,wordbase-square-word-count-bonus-only-overflow-start-224-half-tail,364490,72898,3,"Changed only the heuristic-facing per-square bonus to keep each claimed cell linear through 224 and then credit only half of further overflow, aiming to leave ordinary 40- to 120-word GLAMORIZE- or PERILLED-style lane squares untouched while giving the rare 225-plus overlap hub a few points less influence. The repeated-search profile immediately reproduced the same regression as the other hotspot tapers, dropping from the retained 364630 / 72926 / depth 3 baseline to 364490 / 72898 / depth 3 and switching the principal variation back to INTERROBANG, so reverting without running profile-suite."
