timestamp,status,scenario,commit,change_ref,total_nodes,avg_nodes_per_turn,deepest_completed_depth,notes
2026-03-09T03:45:32-07:00,discarded,profile,working-tree,wordbase-fixed-tt-four-way-exact-priority,227127,45425.4,3,"Retried the fixed-size TT as a 4-slot bucket that refused to evict deeper verified exact entries for shallower bound-only traffic, so a reusable INTERROBANG exact lane could stay resident even when nearby PERILLED-style reply bounds filled the same neighborhood. The repeated-search profile regressed badly to 227127 / 45425.4, and repeats 4 and 5 fell to depth 2, so reverting immediately without running profile-suite."
2026-03-09T04:16:38-07:00,discarded,profile,working-tree,wordbase-equivalent-word-count-tiebreak,365685,73137,3,"Broke exact move-ordering ties with the number of same-text legal paths already present on the board, so if equally scored routes like one-off STERN and repeated STARE lanes tied after the existing broadness signals, the search would try the more geometrically reusable word family first. The repeated-search profile was still bit-for-bit identical to the retained 365685 / 73137 / depth 3 baseline, so treating it as flat and reverting without running profile-suite."
2026-03-09T04:18:36-07:00,discarded,profile,working-tree,wordbase-future-square-coverage-tiebreak,365685,73137,3,"Broke exact move-ordering ties with the number of distinct board squares still covered by the future legal words touching a candidate path, so if equally scored routes left the same number of continuations, the search would try the one that still fanned out toward both STERN-style and STONE-style lanes before one trapped in a tighter STARE cluster. The repeated-search profile was still bit-for-bit identical to the retained 365685 / 73137 / depth 3 baseline, so treating it as flat and reverting without running profile-suite."
2026-03-09T04:20:27-07:00,discarded,profile,working-tree,wordbase-opponent-forward-reach-tiebreak,365685,73137,3,"Broke exact move-ordering ties with the cached opponent forward-reach total on the same claimed squares, so if equally scored routes pushed our lane equally far, the search would try the one that also sat on shallower reply ladders like stealing more of a STONE-style counterlane while keeping the same STERN-style attack depth. The repeated-search profile was still bit-for-bit identical to the retained 365685 / 73137 / depth 3 baseline, so treating it as flat and reverting without running profile-suite."
2026-03-09T04:22:42-07:00,discarded,profile,working-tree,wordbase-raw-geometry-exact-tiebreak,296406,59281.2,3,"Extended exact move-ordering ties with the raw base geometry already inside the heuristic, preferring equally scored lanes that reached farther and spent more letters in advanced rows, so a deeper STONE-style ladder would beat a flatter STERN-style route before falling back to id order. The repeated-search profile regressed to 296406 / 59281.2 / depth 3 because profile 2 dropped to depth 2 at 3858 nodes, so reverting immediately without running profile-suite."
2026-03-09T04:25:01-07:00,discarded,profile,working-tree,wordbase-square-count-before-forward-reach-tiebreak,365685,73137,3,"Reordered exact move-ordering ties so equally scored lanes would prefer broader square-word participation before forward reach, meaning a STERN-style route sitting on more total board continuations would outrank an equally scored STONE-style lane before falling back to geometry. The repeated-search profile was still bit-for-bit identical to the retained 365685 / 73137 / depth 3 baseline, so treating it as flat and reverting without running profile-suite."
2026-03-09T04:27:10-07:00,discarded,profile,working-tree,wordbase-square-forward-reach-bonus-only-per-cell-cap-10,365685,73137,3,"Clipped only the heuristic-facing per-cell forward-reach bonus at 10 while leaving the raw cached reach totals intact for exact-goodness ties, so a move touching one row-11 STONE-style anchor would not outrank a broader STERN/PERILLED lane unless the rest of the board support agreed. The repeated-search profile was still bit-for-bit identical to the retained 365685 / 73137 / depth 3 baseline, so treating it as flat and reverting without running profile-suite."
2026-03-09T04:29:27-07:00,discarded,profile,working-tree,wordbase-average-square-density-bonus,365360,73072,3,"Added a small average square-word-count bonus to the primary heuristic so lanes that stay on rich cells across the whole path, like a broad STERN-style corridor, could outrank longer STONE-style routes that only brush one hotspot. The repeated-search profile slipped slightly but reproducibly to 365360 / 73072 / depth 3 versus the retained 365685 / 73137 / depth 3 baseline, so reverting without running profile-suite."
2026-03-09T04:31:27-07:00,discarded,profile,working-tree,wordbase-square-support-density-exact-tiebreak,365685,73137,3,"Broke exact move-ordering ties with average square-word support after the existing raw totals, so if two routes preserved the same total board participation the search would try the denser STERN-style corridor before a STONE-style detour padded by a dead square. The repeated-search profile was still bit-for-bit identical to the retained 365685 / 73137 / depth 3 baseline, so treating it as flat and reverting without running profile-suite."
2026-03-09T04:34:06-07:00,discarded,profile,working-tree,wordbase-future-progress-total-exact-tiebreak,365685,73137,3,"Added an exact move-ordering tie-break with the summed forward progress of the distinct future words touching a path, so if two routes preserved the same number of continuations the search would try the one that still left deeper STONE/PERILLED-style lanes instead of flatter cleanups. The repeated-search profile was still bit-for-bit identical to the retained 365685 / 73137 / depth 3 baseline, so treating it as flat and reverting without running profile-suite."
2026-03-09T04:35:37-07:00,discarded,profile,working-tree,wordbase-long-future-diversity-divisor-3,365115,73023,3,"Reduced the long-future diversity divisor from 4 to 3 so lanes preserving several long attacks at once, like keeping both PERILLED-style and INTERROBANG-style continuations alive, would pull slightly ahead of routes that mostly leave short cleanup words. The repeated-search profile regressed reproducibly in two runs to 365115 / 73023 / depth 3 versus the retained 365685 / 73137 / depth 3 baseline, so reverting without running profile-suite."
2026-03-09T04:37:20-07:00,discarded,profile,working-tree,wordbase-square-forward-reach-divisor5,364895,72979,3,"Raised the square-forward-reach divisor from 4 to 5 so the existing PERILLED-style deep-lane signal would stay in coarse ordering without crowding out broader future-diversity and square-control buckets. The repeated-search profile regressed clearly to 364895 / 72979 / depth 3 versus the retained 365685 / 73137 / depth 3 baseline, so reverting without running profile-suite."
2026-03-09T04:39:01-07:00,discarded,profile,working-tree,wordbase-long-future-diversity-divisor5,361295,72259,3,"Raised the long-future diversity divisor from 4 to 5 so broad mixed lanes could outrank a single deep family when both still preserved multiple attacks, like preferring a route that keeps medium and long continuations alive over one mostly leaning on an INTERROBANG-style chain. The repeated-search profile regressed clearly to 361295 / 72259 / depth 3 versus the retained 365685 / 73137 / depth 3 baseline, so reverting without running profile-suite."
2026-03-09T04:40:53-07:00,discarded,profile,working-tree,wordbase-future-diversity-divisor3,350100,70020,3,"Raised the overall future-move diversity divisor from 2 to 3 so broad continuation count would stay a supporting board-coverage signal while the retained long-future and square-control features separated stronger lanes, like not letting a route that merely keeps many short STERN/STONE-style starts outrank one with fewer but better-supported attacking continuations. The repeated-search profile regressed clearly to 350100 / 70020 / depth 3 versus the retained 365685 / 73137 / depth 3 baseline, so reverting without running profile-suite."
2026-03-09T04:42:59-07:00,discarded,profile,working-tree,wordbase-square-word-count-divisor2,338735,67747,3,"Raised the square-word-count divisor from 1 to 2 so broad square-control stayed a coarser support signal behind the retained future-diversity and forward-reach features, like not letting a wide but flatter STERN-style corridor outrank a slightly narrower lane that still carries deeper PERILLED-style follow-ups. The repeated-search profile regressed clearly to 338735 / 67747 / depth 3 versus the retained 365685 / 73137 / depth 3 baseline, so reverting without running profile-suite."
2026-03-09T04:45:17-07:00,discarded,profile,working-tree,wordbase-weakest-square-support-divisor8,364840,72968,3,"Added a small weakest-square support bonus so lanes whose entire path stayed on productive cells, like a broad STONE-style corridor, could outrank routes that only brushed one rich hotspot but crossed a thin 5-word bridge square on the way to a PERILLED-style attack. The repeated-search profile slipped slightly to 364840 / 72968 / depth 3 versus the retained 365685 / 73137 / depth 3 baseline, so reverting without running profile-suite."
2026-03-09T04:47:04-07:00,discarded,profile,working-tree,wordbase-square-forward-reach-divisor3,365270,73054,3,"Raised the square-forward-reach weight slightly by lowering its divisor from 4 to 3 so broad lanes whose claimed cells all keep pushing goalward, like a PERILLED corridor, could separate one heuristic bucket earlier from busy but shallower STONE/STERNS-style support routes. The repeated-search profile regressed clearly to 365270 / 73054 / depth 3 versus the retained 365685 / 73137 / depth 3 baseline, so reverting without running profile-suite."
2026-03-09T04:50:23-07:00,kept,profile,working-tree,wordbase-forward-reach-gated-square-count-bonus,368990,73798,3,"Gated the heuristic-facing square-word-count bonus by each square's average forward reach so dense anchors keep full credit only when their nearby continuations still drive goalward; for example a PERILLED-style corridor stays fully valued while a crowded STONE cleanup pocket is discounted unless its local words also keep pushing. The repeated-search profile improved clearly from the retained 365685 / 73137 / depth 3 baseline to 368990 / 73798 / depth 3, so promoting it to profile-suite."
2026-03-09T04:50:23-07:00,kept,profile-suite,working-tree,wordbase-forward-reach-gated-square-count-bonus,1043835,347945.00,4,"Suite verification for the forward-reach-gated square-count bonus: readme-main improved to 368990, driver-sample-a improved to 310025, and driver-sample-b improved sharply to 364820 at depth 4 after the rerun check, for a suite average total_nodes of 347945.00 versus the retained 222628.33 baseline with no board regressions."
2026-03-09T04:52:33-07:00,discarded,profile,working-tree,wordbase-gated-square-count-exact-tiebreak,368990,73798,3,"Added a reach-aware exact tie-break using the ungated square-support total behind the retained heuristic, so if a PERILLED lane and a STONE cleanup pocket still tied after the rounded bonuses and forward-reach totals we would try the route whose dense squares also kept nearby continuations pushing goalward. The repeated-search profile was still bit-for-bit identical to the retained 368990 / 73798 / depth 3 baseline, so treating it as flat and reverting without running profile-suite."
2026-03-09T04:55:50-07:00,discarded,profile,working-tree,wordbase-average-square-forward-reach-bonus,364890,72978,3,"Added a small bonus for the average forward reach across every claimed square so a uniformly goalward PERILLED-style corridor could edge out a slightly longer route whose total reach was padded by one rich launch square despite crossing a weaker STONE-style bridge. The repeated-search profile regressed clearly to 364890 / 72978 / depth 3 versus the retained 368990 / 73798 / depth 3 baseline, so reverting without running profile-suite."
2026-03-09T04:57:42-07:00,discarded,profile,working-tree,wordbase-gated-square-count-exact-total-tiebreak,298949,59789.8,3,"Added an exact tie-break using the raw reach-gated square-support total behind the retained heuristic so two lanes flattened by integer truncation would prefer the corridor whose dense anchors still point goalward, like a PERILLED lane over a STONE-style cleanup pocket. The repeated-search profile collapsed hard to 298949 / 59789.8 / depth 3 versus the retained 368990 / 73798 / depth 3 baseline, so reverting without running profile-suite."
2026-03-09T04:59:54-07:00,discarded,profile,working-tree,wordbase-square-support-before-forward-reach-tiebreak,368990,73798,3,"Reordered the exact tie-breaks so broad square support broke heuristic ties before raw forward reach, aiming to let a wide STONE/STERN-style corridor separate ahead of an equally deep but narrower lane. The repeated-search profile was still bit-for-bit identical to the retained 368990 / 73798 / depth 3 baseline, so treating it as flat and reverting without running profile-suite."
2026-03-09T05:02:14-07:00,discarded,profile,working-tree,wordbase-forward-reach-gated-square-count-floor-three-quarters,365690,73138,3,"Softened the reach gate on square-support from a half-value floor to a three-quarter floor so a broad STONE/STERN-style scaffold would retain more credit when it still preserved medium-depth continuations, while a PERILLED-style corridor would continue to earn the full bonus. The repeated-search profile regressed clearly to 365690 / 73138 / depth 3 versus the retained 368990 / 73798 / depth 3 baseline, so reverting without running profile-suite."
2026-03-09T05:04:14-07:00,discarded,profile,working-tree,wordbase-forward-reach-gated-square-count-buckets,365710,73142,3,"Bucketed the forward-reach gate on square support into shallow / medium / strong bands so a PERILLED-style lane would still get full credit while a STONE cleanup pocket would need a clearer reach jump before its dense anchors gained more weight. The repeated-search profile still regressed slightly to 365710 / 73142 / depth 3 versus the retained 368990 / 73798 / depth 3 baseline, so reverting without running profile-suite."
2026-03-09T05:05:52-07:00,discarded,profile,working-tree,wordbase-gate-only-dense-square-support,368990,73798,3,"Applied the forward-reach gate only to genuinely crowded anchor squares so a thin PERILLED-style lane would keep full support credit on sparse bridge cells while a dense STONE cleanup pocket would still need goalward follow-ups before all of its overlapping words counted at full weight. The repeated-search profile was still bit-for-bit identical to the retained 368990 / 73798 / depth 3 baseline, so treating it as flat and reverting without running profile-suite."
2026-03-09T05:07:36-07:00,discarded,profile,working-tree,wordbase-exact-progress-length-tiebreak,368990,73798,3,"Broke any remaining comparator ties by exact goalward progress and then word length so a deeper STERN-style lane could sort ahead of an equally supported but flatter STONE cleanup route once the retained support metrics were exhausted. The repeated-search profile was still bit-for-bit identical to the retained 368990 / 73798 / depth 3 baseline, so treating it as flat and reverting without running profile-suite."
2026-03-09T05:09:35-07:00,discarded,profile,working-tree,wordbase-average-gated-square-support-bonus,369710,73942,3,"Added a small average-support bonus on top of the retained reach-gated square-count term so a STONE/STERN-style corridor whose whole path stays productive could edge out a route that gets most of its support from one rich launch square and a thin bridge. The repeated-search profile regressed slightly but consistently to 369710 / 73942 / depth 3 versus the retained 368990 / 73798 / depth 3 baseline, so reverting without running profile-suite."
2026-03-09T05:12:25-07:00,discarded,profile,working-tree,wordbase-goalward-gated-support-tiebreak,368990,73798,3,"Broke remaining exact ties with a goalward-weighted version of the retained reach-gated square support so a PERILLED-style corridor whose productive cells stay deep into enemy space could beat a STONE cleanup route that gets similar support mostly from its launch squares. The repeated-search profile was still bit-for-bit identical to the retained 368990 / 73798 / depth 3 baseline, so treating it as flat and reverting without running profile-suite."
2026-03-09T05:46:32-07:00,kept,profile,c5180b6,wordbase-future-diversity-best-interior-support-half-credit-merged,372225,74445,3,"Validated the retained interior-support future-diversity weighting after merging origin/agent-fleet/worker-3. The merged branch kept the best-preserving-cell half/full-credit model, improved the repeated profile again to 372225 / 74445 / depth 3, and profile-suite stayed healthy on readme-main (372225), driver-sample-a (327170), and driver-sample-b (2010)."
