timestamp,status,scenario,commit,change_ref,total_nodes,avg_nodes_per_turn,deepest_completed_depth,notes
2026-03-09T00:00:00-08:00,discarded,profile,working-tree,wordbase-policy-tiebreak-goalward-branching-file,364630,72926,3,"Added an optional disk-backed policy tie-break file with broad static features plus a small goalward-next branching term, but repeated-search profile only reproduced the earlier marginal gain from 364570 to 364630 at depth 3, so reverting without running profile-suite."
2026-03-09T00:05:00-08:00,discarded,profile,working-tree,wordbase-policy-tiebreak-goalward-branching-heavy-file,364630,72926,3,"Retuned the optional policy file to emphasize goalward next-step branching inside equal-goodness groups, aiming to keep PERILLED or INTERROBANG-style interior forks earlier without changing the main heuristic. The repeated-search profile still reproduced the same marginal 364630 result at depth 3, so reverting without running profile-suite."
2026-03-08T23:14:31-07:00,discarded,profile,working-tree,wordbase-policy-linear-tiebreak-raw-table,17535,3507,2,"Added a disk-backed linear policy table that broke equal-goodness ties using raw static features such as forward reach, continuation diversity, and goalward branching, aiming to keep deeper lanes like INTERROBANG ahead of shallow cleanup ties. The repeated-search profile collapsed immediately to depth 2 with 17535 total nodes, so reverting without running profile-suite."
2026-03-08T23:18:59-07:00,discarded,profile,working-tree,wordbase-policy-tiebreak-forward-lanes-file,364570,72914,3,"Added an optional disk-backed policy tie-break stub keyed by broad board-derived averages such as forward reach and long continuation diversity, aiming to keep PERILLED or INTERROBANG-style attack lanes ahead inside equal-goodness buckets. With WORDBASE_POLICY_PATH set to the trial weights file, repeated-search profile stayed exactly flat at 364570 total nodes and depth 3, so reverting without running profile-suite."
2026-03-08T23:27:04-07:00,discarded,profile,working-tree,wordbase-policy-tiebreak-raw-board-features-file,364630,72926,3,"Added an optional disk-backed linear policy hook that attached per-word float scores from raw board-derived tie-break features such as forward reach and long continuation diversity, so equal-goodness lanes like PERILLED or INTERROBANG could separate without changing evaluation. Two conservative weight files both reproduced the same marginal 364630 total_nodes result at depth 3, so reverting without running profile-suite."
2026-03-09T00:18:00-08:00,discarded,profile,working-tree,wordbase-policy-tiebreak-goal-row-coverage-file,360510,72102,3,"Added an optional disk-backed linear policy stub that attached per-word float scores from broad static features plus future goal-row coverage, then used those scores only as a secondary renumbering tie-break so deeper multi-row attack lanes like INTERROBANG-style continuations could edge out shallower cleanup ties. Repeated-search profile stayed at depth 3 but regressed from 364570 to 360510 total_nodes, so reverting without running profile-suite."
2026-03-08T23:33:10-07:00,discarded,profile,working-tree,wordbase-policy-tiebreak-raw-resolution-file,360510,72102,3,"Added an opt-in disk-backed policy stub that attached per-word float scores from raw versions of broad existing features and used them only to break exact goodness ties, aiming to recover divisor-lost resolution so deeper lanes like INTERROBANG or PERILLED could edge out equal-scored cleanup paths. Repeated-search profile regressed from 364570 to 360510 total_nodes at depth 3, so reverting without running profile-suite."
2026-03-08T23:36:54-07:00,discarded,profile,working-tree,wordbase-policy-same-word-lanes-file,360510,72102,3,"Added an optional disk-backed policy-weight stub that attached per-move float scores from broad board-derived features, but only used them to separate exact-goodness alternate paths of the same word so deeper variants like INTERROBANG-style lanes could edge out shallower duplicates without reordering whole buckets. Repeated-search profile regressed from 364570 to 360510 total_nodes at depth 3, so reverting without running profile-suite."
2026-03-08T23:41:35-07:00,discarded,profile,working-tree,wordbase-policy-tiebreak-word-diversity-file,360510,72102,3,"Added an optional disk-backed policy stub over broad static features, including distinct future word-text diversity, and used it only to break equal-goodness buckets so deeper lanes could separate without changing evaluation. Repeated-search profile regressed from 364570 to 360510 total_nodes at depth 3, so reverting without running profile-suite."
2026-03-09T00:35:00-08:00,discarded,profile,working-tree,wordbase-policy-tiebreak-forward-diversity-v3-file,364490,72898,3,"Added an optional disk-backed policy tie-break that stored per-word float scores from broad static features like progress, forward reach, continuation diversity, and bomb touches, then used them only inside equal-goodness groups so INTERROBANG- or PERILLED-style lanes could separate without changing evaluation. Repeated-search profile stayed at depth 3 but slipped from 364570 to 364490 total_nodes, so reverting without running profile-suite."
2026-03-08T23:53:11-07:00,discarded,profile,working-tree,wordbase-killer-history-lmr-conservative,170570,34114,3,"Added depth-indexed killer moves, per-player move-history ordering, and conservative late-move reductions with full-depth re-search on alpha raises, aiming to cut off obvious cleanup lanes earlier while still revisiting deeper Wordbase attacks like PERILLED when a reduced probe improved alpha. Repeated-search profile collapsed from 364570 to 170570 total_nodes at depth 3, so reverting without running profile-suite."
2026-03-08T23:54:53-07:00,discarded,profile,working-tree,wordbase-square-word-count-cap12,279230,55846,3,"Capped each square's word-count contribution at 12 before summing, aiming to keep GLAMORIZE-style rich spine cells helpful while preventing overcrowded duplicate-heavy clusters from dominating move ordering. Repeated-search profile regressed from 364570 to 279230 total_nodes at depth 3, so reverting without running profile-suite."
2026-03-08T23:56:14-07:00,discarded,profile,working-tree,wordbase-square-word-count-taper12-half-overflow,338070,67614,3,"Tapered each square's word-count contribution so the first 12 words stayed linear and only overflow counted at half weight, aiming to keep GLAMORIZE-style rich spine cells strong while reducing duplicate-heavy local clutter. Repeated-search profile regressed from 364570 to 338070 total_nodes at depth 3, so reverting without running profile-suite."
2026-03-09T00:56:00-08:00,discarded,profile,working-tree,wordbase-square-word-count-taper128-half-overflow,346125,69225,3,"Only tapered the extreme square-word-count tail above 128, so ordinary rich spine cells like GLAMORIZE stayed linear while 200+ overlap hubs only got half credit on overflow. Runtime sampling showed median per-cell counts near 45-50 and p95 around 124-161, but repeated-search profile still regressed from 364570 to 346125 total_nodes at depth 3, so reverting without running profile-suite."
2026-03-09T00:00:19-07:00,discarded,profile,working-tree,wordbase-square-word-count-taper160-three-quarters-overflow,356060,71212,3,"Kept square word counts fully linear through 160, then counted only three-quarters of the overflow so ordinary GLAMORIZE-style spine squares stayed untouched while 200-word overlap hubs flattened slightly. Repeated-search profile still regressed from 364570 to 356060 total_nodes at depth 3, so reverting without running profile-suite."
2026-03-09T01:13:00-08:00,discarded,profile,working-tree,wordbase-square-word-count-taper192-seven-eighths-overflow,364430,72886,3,"Only tapered the extreme tail above 192 and kept 7/8 of overflow, so ordinary GLAMORIZE- or PERILLED-style spine squares stayed linear while only the rarest 200+ overlap knots lost a little duplicate-heavy weight. Repeated-search profile was stable at depth 3 but still slipped from 364570 to 364430 total_nodes, so reverting without running profile-suite."
2026-03-09T00:03:08-07:00,discarded,profile,working-tree,wordbase-square-word-count-taper224-seven-eighths-overflow,360590,72118,3,"Kept per-square word counts fully linear through 224 and only shaved the rarest overflow down to 7/8 weight, so ordinary GLAMORIZE- or PERILLED-style lanes stayed untouched while only extreme overlap hubs lost a little duplicate-heavy credit. Repeated-search profile still regressed from 364570 to 360590 total_nodes at depth 3, so reverting without running profile-suite."
2026-03-09T01:25:00-08:00,discarded,profile,working-tree,wordbase-square-word-count-taper192-fifteen-sixteenths-overflow,360180,72036,3,"Kept square word counts fully linear through 192 and only trimmed the rare overflow to 15/16 weight, so GLAMORIZE- or PERILLED-style lanes stayed unchanged while only the most overcrowded 200+-word knots lost a sliver of duplicate-heavy credit. Repeated-search profile still regressed from 364570 to 360180 total_nodes at depth 3, so reverting without running profile-suite."
2026-03-09T00:06:15-07:00,discarded,profile,working-tree,wordbase-square-word-count-taper256-seven-eighths-overflow,364570,72914,3,"Kept square word counts fully linear through 256 and only shaved the rarest overflow to 7/8 weight, so ordinary GLAMORIZE- or PERILLED-style lanes stayed unchanged while only extreme 257+-word overlap hubs lost a sliver of duplicate-heavy credit. Repeated-search profile finished exactly flat at 364570 total_nodes and 72914 avg_nodes_per_turn at depth 3, so reverting without running profile-suite."
2026-03-09T02:10:00-08:00,discarded,profile,working-tree,wordbase-square-word-count-taper256-minus1-per32-overflow,364570,72914,3,"Kept square word counts fully linear through 256, then let each extra 32 overlapping words add only 1 more point so GLAMORIZE- or PERILLED-style rich lanes stayed intact while extreme duplicate-heavy 288+ hubs barely pulled ahead. Repeated-search profile finished exactly flat at 364570 total_nodes and 72914 avg_nodes_per_turn at depth 3, so reverting without running profile-suite."
2026-03-09T00:08:58-07:00,discarded,profile,working-tree,wordbase-square-word-count-taper256-thirty-one-thirty-seconds-overflow,364570,72914,3,"Kept square word counts fully linear through 256, then shaved only 1/32 off the rare overflow so ordinary GLAMORIZE- or PERILLED-style rich lanes stayed unchanged while only extreme 257+-word overlap hubs lost a trace of duplicate-heavy weight. Repeated-search profile finished exactly flat at 364570 total_nodes and 72914 avg_nodes_per_turn at depth 3, so reverting without running profile-suite."
2026-03-09T00:10:22-07:00,discarded,profile,working-tree,wordbase-square-word-count-taper224-fifteen-sixteenths-overflow,360590,72118,3,"Kept square word counts fully linear through 224 and only trimmed the rare overflow to 15/16 weight, so ordinary GLAMORIZE- or PERILLED-style rich lanes stayed unchanged while only extreme 225+-word overlap hubs lost a sliver of duplicate-heavy credit. Repeated-search profile still regressed from 364570 to 360590 total_nodes at depth 3, so reverting without running profile-suite."
2026-03-09T00:12:21-07:00,discarded,profile,working-tree,wordbase-square-word-count-taper128-half-overflow,346125,69225,3,"Kept per-square word counts fully linear through 128, then counted only half of the overflow so ordinary GLAMORIZE-style spine squares still separated from dead cells while 200+-word duplicate hubs stopped scaling one-for-one. Repeated-search profile regressed sharply from 364570 to 346125 total_nodes at depth 3, so reverting without running profile-suite."
2026-03-09T00:14:20-07:00,discarded,profile,working-tree,wordbase-square-word-count-cap192,357485,71497,3,"Clamped each claimed square's word-count bonus at 192 so ordinary rich lanes stayed linear while only rare 200+-word overlap hubs stopped outscoring cleaner deep paths like GLAMORIZE or PERILLED. Repeated-search profile regressed from 364570 to 357485 total_nodes at depth 3, so reverting without running profile-suite."
2026-03-09T00:16:05-07:00,discarded,profile,working-tree,wordbase-square-word-count-sqrt-buckets-16-64-144-256,296150,59230,3,"Compressed each square word-count contribution into coarse sqrt-like buckets so rich GLAMORIZE or PERILLED lanes still beat dead cells, but 200+ overlap knots stopped scaling linearly. Repeated-search profile regressed sharply from 364570 to 296150 total_nodes at depth 3, so reverting without running profile-suite."
2026-03-09T00:17:51-07:00,discarded,profile,working-tree,wordbase-square-word-count-plus-min-count-96,24415,4883,2,"Replaced each cell's linear count with count plus min(count, 96) so ordinary rich GLAMORIZE- or PERILLED-style lanes stayed far above dead cells while 200+-word overlap hubs stopped scaling without bound. The repeated-search profile collapsed from 364570 total_nodes at depth 3 to 24415 total_nodes at depth 2, so reverting immediately without running profile-suite."
2026-03-09T02:23:37-08:00,discarded,profile,working-tree,wordbase-square-word-count-taper240-minus1-per32-overflow,364570,72914,3,"Kept square word counts fully linear through 240, then let each extra 32 overlapping words remove only 1 point of overflow so ordinary GLAMORIZE- or PERILLED-style lanes stayed unchanged while only extreme duplicate-heavy hubs softened slightly. Repeated-search profile finished exactly flat at 364570 total_nodes and 72914 avg_nodes_per_turn at depth 3, so reverting without running profile-suite."
2026-03-09T00:21:12-07:00,discarded,profile,working-tree,wordbase-square-word-count-taper224-thirty-one-thirty-seconds-overflow,364570,72914,3,"Kept square word counts fully linear through 224, then shaved only 1/32 off the rare overflow so ordinary GLAMORIZE- or PERILLED-style lanes stayed unchanged while only 225+-word overlap hubs lost a trace of duplicate-heavy weight. Repeated-search profile finished exactly flat at 364570 total_nodes and 72914 avg_nodes_per_turn at depth 3, so reverting without running profile-suite."
2026-03-09T00:22:47-07:00,discarded,profile,working-tree,wordbase-square-word-count-taper192-seven-eighths-overflow,364430,72886,3,"Kept square word counts fully linear through 192, then counted only 7/8 of the overflow so ordinary rich GLAMORIZE- or PERILLED-style lanes stayed unchanged while rare 193+-word hubs lost a little duplicate-heavy weight. Repeated-search profile slipped from 364570 to 364430 total_nodes at depth 3, so reverting without running profile-suite."
2026-03-09T00:24:35-07:00,discarded,profile,working-tree,wordbase-square-word-count-taper192-minus1-per16-overflow,364220,72844,3,"Kept square word counts fully linear through 192, then removed only 1 point per extra 16 overlaps so ordinary GLAMORIZE- or PERILLED-style lanes stayed effectively unchanged while a rare 256-word duplicate knot lost just 4 points. Repeated-search profile still regressed from 364570 to 364220 total_nodes at depth 3, so reverting without running profile-suite."
2026-03-09T00:26:05-07:00,discarded,profile,working-tree,wordbase-square-word-count-taper256-half-overflow,364570,72914,3,"Kept square word counts fully linear through 256, then counted only half of any extra overlaps so ordinary GLAMORIZE- or PERILLED-style lanes stayed unchanged while rare 257+-word duplicate hubs stopped scaling one-for-one. Repeated-search profile finished exactly flat at 364570 total_nodes and 72914 avg_nodes_per_turn at depth 3, so reverting without running profile-suite."
2026-03-09T00:28:27-07:00,discarded,profile,working-tree,wordbase-square-word-count-taper224-half-overflow,364220,72844,3,"Kept square word counts fully linear through 224, then counted only half of the last rare overflow so ordinary GLAMORIZE- or PERILLED-style rich lanes stayed unchanged while a 231-word duplicate-heavy knot only got half-credit for the final 7 overlaps. Repeated-search profile slipped from 364570 to 364220 total_nodes at depth 3, so reverting without running profile-suite."
2026-03-09T00:30:03-07:00,discarded,profile,working-tree,wordbase-square-word-count-taper228-fifteen-sixteenths-overflow,360590,72118,3,"Kept square word counts fully linear through 228, then shaved only 1/16 off the rare 229+ overflow so ordinary GLAMORIZE- or PERILLED-style lanes stayed unchanged while only the most overloaded duplicate-heavy hubs lost a single point of tail credit. Repeated-search profile regressed from 364570 to 360590 total_nodes at depth 3, so reverting without running profile-suite."
2026-03-09T00:32:47-07:00,discarded,profile,working-tree,wordbase-square-word-count-cap208,362515,72503,3,"Capped each square's raw word-count contribution at 208 so ordinary GLAMORIZE- or PERILLED-style rich lanes stayed fully linear while only the single 231-word outlier hub on the profile board stopped outranking cleaner deep lanes by raw overlap alone. Repeated-search profile regressed from 364570 to 362515 total_nodes at depth 3, so reverting without running profile-suite."
2026-03-09T00:34:07-07:00,discarded,profile,working-tree,wordbase-square-word-count-linear160-half-overflow,350295,70059,3,"Changed each square contribution to stay linear through 160, then count only half of any extra overlap so ordinary GLAMORIZE- or PERILLED-style lanes kept their board-derived signal while a 231-word duplicate-heavy knot lost a broader tail. Repeated-search profile regressed sharply from 364570 to 350295 total_nodes at depth 3, so reverting without running profile-suite."
2026-03-09T00:35:44-07:00,discarded,profile,working-tree,wordbase-square-word-count-quadratic4096,352185,70437,3,"Applied a smooth quadratic taper per claimed square via count - count^2/4096 so a 100-word GLAMORIZE-style lane only lost a couple of points while a 231-word duplicate-heavy knot lost 13. Repeated-search profile regressed sharply from 364570 to 352185 total_nodes at depth 3, so reverting without running profile-suite."
2026-03-09T00:36:54-07:00,discarded,profile,working-tree,wordbase-square-word-count-cap230,360590,72118,3,"Clamped each square's raw word-count contribution at 230 so ordinary GLAMORIZE- or PERILLED-style rich lanes stayed fully linear while only the single 231-word overlap knot lost its last point of duplicate-heavy credit. Repeated-search profile regressed from 364570 to 360590 total_nodes at depth 3, so reverting without running profile-suite."
2026-03-09T00:40:45-07:00,discarded,profile,working-tree,wordbase-square-word-count-taper128-sixty-three-sixty-fourths-overflow,361040,72208,3,"Kept square word counts fully linear through 128, then shaved only 1/64 of the overflow so GLAMORIZE- or PERILLED-style lanes still dominated dead cells while several 139-231 word hotspots each lost just 1-2 points of clutter-heavy credit. Repeated-search profile regressed from 364570 to 361040 total_nodes at depth 3, so reverting without running profile-suite."
2026-03-09T00:42:53-07:00,discarded,profile,working-tree,wordbase-square-word-count-minus1-per64,359950,71990,3,"Made each claimed square lose one point of word-count credit per 64 overlapping words, so a GLAMORIZE-style 96-word lane still stayed near-linear at 95 while a 231-word clutter hub dropped to 228. Repeated-search profile regressed from 364570 to 359950 total_nodes at depth 3, so reverting without running profile-suite."
2026-03-09T00:45:08-07:00,discarded,profile,working-tree,wordbase-square-word-count-linear224-half-overflow,364220,72844,3,"Kept each square's word-count bonus fully linear through 224, then counted only half of any extra overlap so ordinary GLAMORIZE- or PERILLED-style lanes stayed unchanged while the single 231-word clutter hub dropped to 227. Repeated-search profile slipped from 364570 to 364220 total_nodes at depth 3, so reverting without running profile-suite."
2026-03-09T00:47:08-07:00,discarded,profile,working-tree,wordbase-square-word-count-linear224-three-quarters-overflow,360590,72118,3,"Kept each square's word-count bonus fully linear through 224, then retained about three quarters of any extra overlap with rounding so 225-227 word rich lanes stayed unchanged while the 231-word clutter hub only fell to 229. Repeated-search profile regressed from 364570 to 360590 total_nodes at depth 3, so reverting without running profile-suite."
2026-03-09T00:48:50-07:00,discarded,profile,working-tree,wordbase-square-word-count-minus1-per128,364160,72832,3,"Applied a tiny global compression to per-square word counts via count minus count divided by 128, so a 96-word GLAMORIZE spine square stayed unchanged while a 231-word clutter hub only fell to 230. Repeated-search profile still slipped from 364570 to 364160 total_nodes at depth 3, so reverting without running profile-suite."
2026-03-09T00:51:00-07:00,discarded,profile,working-tree,wordbase-square-word-count-quadratic49152,360590,72118,3,"Applied a very high-threshold quadratic taper per claimed square via count minus count squared divided by 49152, so a 96-word GLAMORIZE spine square stayed 96 while only low-220s-plus overlap hubs shrank, with the 231-word clutter knot dropping to 230. Repeated-search profile still regressed from 364570 to 360590 total_nodes at depth 3, so reverting without running profile-suite."
2026-03-09T00:52:43-07:00,discarded,profile,working-tree,wordbase-square-word-count-linear96-half-saturation,341560,68312,3,"Changed each claimed square to use (count + min(count, 96)) / 2 so a 96-word GLAMORIZE spine square stayed fully valued while a 231-word duplicate-heavy knot fell to 163 and stopped dominating cleaner PERILLED-style lanes. Repeated-search profile regressed sharply from 364570 to 341560 total_nodes at depth 3, so reverting without running profile-suite."
