timestamp,status,scenario,commit,change_ref,total_nodes,avg_nodes_per_turn,deepest_completed_depth,notes
2026-03-08T20:14:09-07:00,baseline,profile,bf81c22,steady-state-profiling-benchmark,246590,49318,3,"5 repeated searches after 2 warmup turns; benchmark from scripts/run-benchmarks.sh profile"
2026-03-08T20:14:09-07:00,kept,profile,e15793c,tt-verification-key,246590,49318,3,"Added independent TT verification key and collision regression test; no measured node change on profile baseline"
2026-03-08T20:14:09-07:00,discarded,profile,working-tree,pvs-null-window,190870,38174,3,"Principal variation search reduced repeated-search throughput versus baseline; reverted"
2026-03-08T20:14:09-07:00,discarded,profile,working-tree,tt-hash-move-ordering,174115,34823,3,"TT move-to-front ordering reduced repeated-search throughput versus baseline; reverted"
2026-03-08T20:14:09-07:00,discarded,profile,working-tree,fixed-size-tt-table,246590,49318,3,"Direct-index TT table with simple overwrite policy did not improve repeated-search node count; reverted"
2026-03-08T20:14:09-07:00,discarded,profile,working-tree,root-pv-ordering,208000,41600,3,"Iterative-deepening root preferred move ordering reduced repeated-search throughput versus baseline; reverted"
2026-03-08T20:14:09-07:00,discarded,profile,working-tree,cached-goodness-evaluation,246590,49318,3,"Incremental leaf evaluation preserved behavior but did not improve repeated-search node count; reverted"
2026-03-08T20:14:09-07:00,discarded,profile,working-tree,killer-moves,174125,34825,3,"Generic killer-move ordering reduced repeated-search throughput versus baseline; reverted"
2026-03-08T20:14:09-07:00,kept,profile,75be3ca,wordbase-path-heuristic-v1,275945,55189,3,"Added static move-ordering bonuses for word length, edge progress, and bomb contact; repeated-search baseline improved and reproduced"
2026-03-08T20:14:09-07:00,discarded,profile,working-tree,wordbase-path-heuristic-v2-edge-bonus,258010,51602,3,"Extra near-edge bonus reduced repeated-search throughput versus v1; reverted"
2026-03-08T20:14:09-07:00,discarded,profile,working-tree,wordbase-path-heuristic-v3-no-bomb-bonus,238095,47619,3,"Removing bomb and megabomb bonuses reduced repeated-search throughput versus v1; reverted"
2026-03-08T20:14:09-07:00,discarded,profile,working-tree,wordbase-path-heuristic-v4-endpoint-bonus,252465,50493,3,"Endpoint-row bonus reduced repeated-search throughput versus v1; reverted"
2026-03-08T20:14:09-07:00,discarded,profile,working-tree,wordbase-path-heuristic-v5-length24,237915,47583,3,"Increasing the length bonus above v1 reduced repeated-search throughput; reverted"
2026-03-08T20:14:09-07:00,discarded,profile,working-tree,wordbase-path-heuristic-v6-progress40,252795,50559,3,"Increasing the progress bonus above v1 reduced repeated-search throughput; reverted"
2026-03-08T20:14:09-07:00,discarded,profile,working-tree,wordbase-path-heuristic-v7-progress24,275140,55028,3,"Lowering the progress bonus was close to v1 but still slightly worse; reverted"
2026-03-08T20:14:09-07:00,discarded,profile,working-tree,wordbase-path-heuristic-v8-bomb64,264610,52922,3,"Lowering bomb and megabomb bonuses reduced repeated-search throughput versus v1; reverted"
2026-03-08T20:14:09-07:00,discarded,profile,working-tree,wordbase-path-heuristic-v9-span24,238185,47637,3,"Forward-span bonus reduced repeated-search throughput versus v1; reverted"
2026-03-08T20:14:09-07:00,discarded,profile,working-tree,recordOne-already-owned-early-return,275945,55189,3,"Skipping already-owned cells in recordOne preserved behavior but did not improve the repeated-search baseline"
2026-03-08T20:14:09-07:00,discarded,profile,working-tree,recordOne-iterative-propagation,275945,55189,3,"Iterative bomb propagation in recordOne preserved behavior but did not improve the repeated-search baseline; reverted"
2026-03-08T20:14:09-07:00,discarded,profile,working-tree,dynamic-front-window-ordering,187145,37429,3,"State-aware front-window reranking by claimable and enemy path cells reduced repeated-search throughput badly versus v1; reverted"
2026-03-08T20:14:09-07:00,discarded,profile,working-tree,wordbase-square-mobility-divisor8,261675,52335,3,"Adding a weak future-mobility bonus from per-square legal-word counts underperformed the stronger variants"
2026-03-08T20:14:09-07:00,discarded,profile,working-tree,wordbase-square-mobility-divisor4,277530,55506,3,"A moderate future-mobility bonus improved profile slightly but was dominated by stronger scaling"
2026-03-08T20:14:09-07:00,discarded,profile,working-tree,wordbase-square-mobility-divisor2,278125,55625,3,"A stronger future-mobility bonus improved profile but still underperformed divisor1"
2026-03-08T20:14:09-07:00,kept,profile,working-tree,wordbase-square-mobility-divisor1,339260,67852,3,"Added a per-square future-mobility bonus from legal-word counts across the claimed path; profile rose from 275945 to 339260 and short rose from 81916 to 84370"
2026-03-08T20:14:09-07:00,discarded,profile,working-tree,depth-based-move-cap-120-60,122100,24420,3,"Shrinking the move cap aggressively by ply cut away too much search and reduced both short and repeated-search benchmarks"
2026-03-08T20:14:09-07:00,discarded,profile,working-tree,wordbase-forward-mobility-bonus-32,337075,67415,3,"Extra forward-weighted mobility on top of raw mobility improved short slightly but lost on repeated search"
2026-03-08T20:14:09-07:00,discarded,profile,working-tree,wordbase-future-diversity-divisor8,339725,67945,3,"A weak future-move diversity bonus was worse than the stronger diversity variants"
2026-03-08T20:14:09-07:00,discarded,profile,working-tree,wordbase-future-diversity-divisor4,345410,69082,3,"A moderate future-move diversity bonus improved on raw mobility but was beaten by divisor2"
2026-03-08T20:14:09-07:00,discarded,profile,working-tree,wordbase-future-diversity-divisor1,22785,4557,2,"Overweighting future-move diversity collapsed the search and dropped completed depth"
2026-03-08T20:14:09-07:00,kept,profile,working-tree,wordbase-future-diversity-divisor2,354475,70895,3,"Added a future-move diversity bonus based on unique legal starts unlocked by the claimed path; profile rose from 339260 to 354475 and short rose to 87822"
2026-03-08T20:14:09-07:00,discarded,profile,working-tree,tt-hash-move-ordering-retest,182050,36410,3,"TT hash-move ordering still reduced throughput badly even after the stronger Wordbase ordering baseline; reverted"
2026-03-08T20:14:09-07:00,discarded,profile,working-tree,wordbase-deep-diversity-frontier,221088,44217,3,"Biasing diversity toward the deepest claimed cells looked promising in one run but was not repeatable and was reverted"
2026-03-08T20:14:09-07:00,discarded,profile,working-tree,wordbase-peak-anchor-quality,81955,16391,2,"Using the best future word from claimed anchors overfit flashy lines and collapsed repeated-search depth"
2026-03-08T20:14:09-07:00,discarded,profile,working-tree,wordbase-long-word-count,17775,3555,2,"Counting long future words per square was another unstable anchor-quality signal and was reverted"
2026-03-08T20:14:09-07:00,kept,profile,working-tree,wordbase-long-future-diversity,364230,72846,3,"Added a long-word diversity bonus so paths preserving many distinct long threats are ordered earlier; profile rose from 354475 to 364230"
2026-03-08T21:21:32-07:00,kept,profile,0ca2b91,find-first-renumbered-goodness,364230,72846,3,Use_find_first_no_behavior_change
2026-03-08T21:22:25-07:00,discarded,profile,working-tree,wordbase-bend-penalty-k8,363915,72783,3,"Added a small bend penalty to prefer straighter lanes; repeated-search nodes regressed slightly vs baseline 364230 so reverting"
2026-03-08T21:23:04-07:00,discarded,profile,working-tree,endpoint-anchor-bonus-divisor6,364230,72846,3,No measurable change versus baseline; reverted to divisor8
2026-03-08T21:23:16-07:00,kept,profile,working-tree,wordbase-letter-rarity-target6-divisor2,364270,72854,3,"Added a rare-letter tie-breaker favoring paths that claim scarce letters (e.g., the lone 'z' along GLAMORIZE). On the profile scenario total_nodes rose from 364230 to 364270 and deepest_completed_depth stayed 3; effect is tiny but repeatable."
2026-03-08T21:23:30-07:00,discarded,profile,working-tree,wordbase-neighborhood-halo-divisor48,18005,3601,2,"Added a very weak 8-neighbor halo bonus; repeated-search depth collapsed from 3 to 2, so reverting"
2026-03-08T21:26:45-07:00,discarded,profile,working-tree,wordbase-neighborhood-max-halo-k96,364230,72846,3,Added a max-halo neighborhood tie-breaker (3x3 local mobility, single best cell per path) with a stiff divisor; profile repeated-search nodes unchanged vs baseline so reverting
2026-03-08T21:27:14-07:00,discarded,profile,working-tree,wordbase-letter-rarity-target6-divisor2,364230,72846,3,"After implementing the rare-letter tie-breaker, repeated-search totals matched baseline (no throughput or depth change). Keeping tree clean and reverting."
2026-03-08T21:31:51.827024-07:00,discarded,profile,working-tree,wordbase-row-band-diversity-weight8,364230,72846,3,"Added a row-band diversity bonus that rewards paths spanning many distinct rows (e.g., GLAMORIZE diagonal vs GLASS horizontal). Repeated-search totals unchanged vs baseline; reverting."
2026-03-08T21:34:17-07:00,discarded,profile,working-tree,wordbase-column-band-diversity-weight8,364230,72846,3,"Added a small column-band diversity bonus so diagonals like GLAMORIZE beat one-file paths like EEL when other signals tie. Repeated-search totals reproduced exactly at baseline, so reverting."
2026-03-08T21:35:19-07:00,discarded,profile,working-tree,wordbase-frontier-square-word-count-divisor6,364230,72846,3,"Added a frontier mobility bonus from unique neighboring squares around the claimed path (e.g., GLAMORIZE leaves side shoulders; EEL mostly stacks starts on one file). At divisor 6 the repeated-search profile stayed exactly at baseline, so trying a stronger scaling."
2026-03-08T21:35:51-07:00,discarded,profile,working-tree,wordbase-frontier-square-word-count-divisor2,345895,69179,3,"Strengthening the frontier neighboring-word-count bonus reordered search in the wrong direction: repeated-search profile fell from 364230 to 345895 while depth stayed 3. Reverting that scaling and trying a less correlated frontier signal."
2026-03-08T21:36:25-07:00,discarded,profile,working-tree,wordbase-frontier-square-count-weight12,340310,68062,3,"Switched to a geometry-only frontier count that rewards paths exposing many neighboring squares. It was even noisier: repeated-search profile fell to 340310 with no extra depth, so reverting to the known-good baseline."
2026-03-08T21:39:08-07:00,discarded,profile,working-tree,wordbase-future-word-text-diversity-divisor4,364230,72846,3,"Counted distinct future word texts so a lane leaving {stare, stern, stone} would outrank one mostly preserving repeated GLAMORIZE placements. At divisor 4 the repeated-search profile matched the 364230 baseline exactly, so reverting."
2026-03-08T21:39:08-07:00,discarded,profile,working-tree,wordbase-future-word-text-diversity-divisor2,364230,72846,3,"Strengthening the distinct future word-text bonus still produced the exact 364230 repeated-search profile total with depth 3. The text-level signal was too correlated with the existing mobility/diversity stack, so reverting."
2026-03-08T21:41:42-07:00,discarded,profile,working-tree,wordbase-future-progress-row-coverage-weight8,17760,3552,2,"Rewarded paths whose future follow-ups land on several forward rows instead of one band. That reordered the profile position badly enough to stall at depth 2 on every repeated search, so reverting."
2026-03-08T21:42:52-07:00,discarded,profile,working-tree,wordbase-future-start-square-coverage-weight6,18005,3601,2,"Rewarded paths that preserved many distinct future start squares. That favored noisy multi-anchor clutter over the baseline ordering and every repeated search stalled at depth 2, so reverting."
2026-03-08T21:43:36-07:00,discarded,profile,working-tree,wordbase-long-future-start-square-coverage-weight8,18005,3601,2,"Restricted the start-square coverage bonus to long follow-ups only, hoping to favor separate long-threat anchors. It still shoved the profile search into the same bad depth-2 ordering, so reverting."
2026-03-08T21:47:48-07:00,discarded,profile,working-tree,wordbase-long-square-word-count-divisor4,17775,3555,2,"Summed per-square counts of long words along the claimed path so the middle of a GLAMORIZE lane would outrank side squares that mostly feed GLASS. The signal was far too strong: repeated-search depth fell from 3 to 2, so reverting."
2026-03-08T21:47:48-07:00,kept,profile,working-tree,wordbase-square-forward-reach-divisor4,364570,72914,3,"Added a small per-square forward-reach bonus based on the average depth of words through each claimed cell, so lanes used by deeper attacks like PERILLED break ties over squares whose words stall locally. The repeated-search profile improved reproducibly from 364230 to 364570 in two runs, and short held at 87981."
2026-03-08T22:04:37-07:00,discarded,profile,working-tree,wordbase-square-forward-extension-divisor4,364500,72900,3,"Added a small per-square runway bonus for cells whose words usually continue farther after that square, so early spine cells in lanes like GLAMORIZE could beat terminal cells that often end the attack. The repeated-search profile slipped from 364570 to 364500 at depth 3, so reverting."
2026-03-08T22:27:03-07:00,discarded,profile,working-tree,wordbase-letter-rarity-gated-by-forward-reach-target6-divisor2,364570,72914,3,"Gated the small rare-letter bonus behind above-average square forward reach so a deep-lane 'z' in GLAMORIZE could still matter without boosting shallow side-branch rarities. The repeated-search profile matched the current 364570 baseline exactly across all five runs, so reverting."
2026-03-08T22:29:27-07:00,discarded,profile,working-tree,wordbase-reach-gated-letter-rarity-target6-divisor2-margin1,364570,72914,3,"Scaled scarce-letter tie-breaks through the kept square forward-reach table so only above-average lane cells contributed rarity, aiming to keep the GLAMORIZE z signal while muting shallow side branches like EEL. The repeated-search profile matched the 364570 baseline exactly at depth 3, so reverting."
2026-03-08T22:30:51-07:00,discarded,profile,working-tree,wordbase-strong-square-forward-reach-count-average-plus1-divisor2,364570,72914,3,"Rewarded paths only when multiple claimed cells had forward-reach scores at least one point above the board average, aiming to prefer uniformly deep lanes like PERILLED over paths with one peak GLAMORIZE anchor and shallow cleanup squares. The repeated-search profile matched the 364570 baseline exactly across all five runs, so reverting."
2026-03-08T22:33:19-07:00,discarded,profile,working-tree,wordbase-forward-reach-strong-cell-count-threshold-average-plus1-divisor3,364220,72844,3,"Counted claimed cells at or above the board-average forward reach plus one, aiming to reward lanes with several strong interior squares like PERILLED instead of one peak cell. The repeated-search profile slipped from 364570 to 364220 at depth 3, so reverting."
2026-03-08T22:35:08-07:00,discarded,profile,working-tree,wordbase-square-forward-reach-excess-average-divisor8,360320,72064,3,"Added a tiny bonus for only the above-average forward-reach excess on claimed cells, aiming to reward lanes with several strong interior squares like PERILLED over a path with one GLAMORIZE anchor and shallow cleanup cells. The repeated-search profile regressed from 364570 to 360320 at depth 3, so reverting."
2026-03-08T22:37:07-07:00,discarded,profile,working-tree,wordbase-consistent-forward-reach-cell-count-average-threshold-bonus1,364430,72886,3,"Added a tiny fixed bonus when at least two claimed cells had board-average forward reach, aiming to reward lanes with multiple solid interior squares like PERILLED over paths propped up by one standout GLAMORIZE anchor. The repeated-search profile slipped from 364570 to 364430 at depth 3, so reverting."
2026-03-08T22:39:06-07:00,discarded,profile,working-tree,wordbase-median-strong-forward-reach-count-square-divisor4,351930,70386,3,"Added a tiny median-threshold consistency bonus that squared the count of claimed cells with at-least-typical forward reach, aiming to prefer uniformly deep lanes like PERILLED over routes carried by one strong GLAMORIZE anchor. The repeated-search profile regressed sharply from 364570 to 351930 at depth 3, so reverting."
2026-03-08T23:00:00-07:00,discarded,profile,working-tree,wordbase-forward-reach-support-minus-best-cell-divisor8,360160,72032,3,"Kept the existing per-square forward-reach sum and added a tiny support term from all claimed cells except the best one, aiming to favor lanes with several solid interior squares like PERILLED over routes propped up by one GLAMORIZE anchor. The repeated-search profile regressed from 364570 to 360160 at depth 3, so reverting."
2026-03-08T22:41:35-07:00,discarded,profile,working-tree,wordbase-square-word-count-forward-reach-gate6-half-credit,292440,58488,3,"Gated each claimed cell's raw word-count bonus by that same side-to-move square forward reach, keeping full credit only for deeper lanes like GLAMORIZE or PERILLED and halving shallow cleanup pockets like EEL. The repeated-search profile regressed sharply from 364570 to 292440 at depth 3, so reverting."
2026-03-08T23:12:00-07:00,discarded,profile,working-tree,wordbase-square-word-count-forward-reach-crowding-excess-half,339410,67882,3,"Kept the raw per-cell count bonus but shaved half of any count beyond that cells forward reach plus two, so deep GLAMORIZE squares kept most credit while shallow EEL-style crowding paid less. The repeated-search profile regressed from 364570 to 339410 at depth 3, so reverting."
2026-03-08T22:44:30-07:00,discarded,profile,working-tree,wordbase-square-word-count-forward-reach-crowding-excess-quarter,345185,69037,3,"Kept the raw path word-count sum and only subtracted one point for each four surplus count points above same-cell forward reach plus two, so shallow EEL-style crowding lost just a tiny tie-break share while deep GLAMORIZE lanes stayed nearly unchanged. The repeated-search profile still regressed from 364570 to 345185 at depth 3, so reverting."
2026-03-08T22:46:30-07:00,discarded,profile-suite,working-tree,wordbase-square-goalward-next-branching-divisor3,87117,17423,3,"Counted only distinct next-step neighbors that continued words without retreating from each claimed square, aiming to keep PERILLED or INTERROBANG style goalward forks while cutting sideways EEL clutter. Standalone profile improved marginally and reproducibly from 364570 to 365445 at depth 3, but profile-suite failed badly: on readme-main four of five repeated searches dropped to depth 2, so reverting."
2026-03-08T22:48:21-07:00,discarded,profile,working-tree,wordbase-square-remaining-goalward-reach-divisor8,264855,52971,3,"Added a tiny per-square bonus for how many goalward rows legal words usually still gained after touching each claimed cell, aiming to favor interior attack lanes like PERILLED over cleanup pockets like EEL. The repeated-search profile regressed sharply from 364570 to 264855 at depth 3, so reverting."
2026-03-08T22:50:41-07:00,discarded,profile,working-tree,wordbase-square-goalward-next-branching-divisor4,360650,72130,3,"Retried the distinct goalward next-step branching table at a weaker weight so interior PERILLED or INTERROBANG forks still nudged ties without dominating the kept forward-reach signal. The repeated-search profile still regressed from 364570 to 360650 at depth 3, so reverting without running profile-suite."
2026-03-08T22:53:05-07:00,discarded,profile,working-tree,wordbase-square-goalward-next-only-branching-divisor4,360650,72130,3,"Counted only distinct goalward next cells from each claimed square, so PERILLED-style interior forks kept credit while sideways EEL cleanups lost it. The repeated-search profile still regressed from 364570 to 360650 at depth 3, so reverting without running profile-suite."
2026-03-08T22:55:35-07:00,discarded,profile,working-tree,wordbase-square-forward-reach-divisor3,364040,72808,3,"Raised the kept per-square forward-reach bonus from divisor 4 to 3, testing whether deeper lanes like PERILLED simply needed a bit more tie-break weight than shallower cleanup squares. The repeated-search profile regressed from 364570 to 364040 at depth 3, so reverting without running profile-suite."
2026-03-08T22:59:06-07:00,discarded,profile,working-tree,wordbase-policy-ordering-linear-table-top64,39245,7849,2,"Added an optional policy-ordering prototype that rescored the first 64 baseline candidates from a cached linear table over static board features such as progress, forward reach, and long continuation diversity, aiming to favor deeper lanes like PERILLED over cleanup words like EEL. The repeated-search profile collapsed from 364570 to 39245 total nodes and dropped from depth 3 to depth 2 on every measured search, so reverting without running profile-suite."
2026-03-08T23:03:40-07:00,discarded,profile,working-tree,wordbase-policy-ordering-linear-tiebreak-file,364630,72926,3,"Added an opt-in cached policy table that assigned a separate linear score from broad static features and used it only to break ties between equal baseline goodness values, so PERILLED-style deep lanes could edge out shallow cleanup routes without the previous top-64 reshuffle. The repeated-search profile reproduced a tiny gain from 364570 to 364630 at depth 3 in two runs, but the win was too small to clear the keep bar, so reverting without running profile-suite."
